name,category,description,ingredients,diet_tags,allergens,sweet,sour,bitter,spicy,dry
Brazilian Black Bean Roasted Pork,Roast/Braise,"Montreal seasoned pork loin topped with a smoky Brazilian black bean sauce, cilantro & orange","Pork Loin, Water, Black Beans, Oranges, Bacon (Pork Cured With: Water, Salt, Sugar, Sodium Phosphates, Sodium Erythorbate, Sodium Nitrite.), Onion, Green Bell Pepper, Cilantro, Lime Juice, Chicken Base (CHICKEN MEAT AND NATURAL CHICKEN JUICES, MALTODEXTRIN, AUTOLYZED YEAST EXTRACT, NATURAL FLAVORS, SALT, CORN STARCH, 2% OR LESS OF VEGETABLE OIL (CORN AND/OR CANOLA OIL), DISODIUM INOSINATE, DRIED CHICKEN BROTH, TURMERIC AND ANNATTO (COLOR), POTATO STARCH, DISODIUM GUANYLATE, CHICKEN FAT, PAPRIKA (COLOR), DRIED CHICKEN, SUGAR, SPICES, PAPAIN, CITRIC ACID.), Canola Oil, Garlic, Kosher Salt, Paprika, Black Pepper, Cilantro, Cumin, Coriander",,,1.5,1.0,0.5,1.5,1.5
"CHICKEN, BAKED, HERBED, CREAM SAUCE",Roast/Braise,"Roasted, Chopped chicken coated with Herb seasonings Topped with a Brown Butter Cream Sauce","Chicken Thigh, Unsalted Butter, Heavy Cream, Parmesan Cheese, Onion, Kosher Salt, Garlic, Kosher Salt, Dried Thyme Leaf, Dried Rosemary, Dried Oregano, Dried Basil, Thyme, Crushed Red Pepper",,,0.5,0.0,0.5,0.5,1.0
Chicken Souvlaki,Grilled,"Grilled chicken skewer marinated in garlic, lemon, red wine vinegar and oregano","Chicken Thigh, Lemon Juice, Vegetable Oil Blend (Vegetable Oil (May contain one or more of the following: Soybean, Canola, Corn, Sunflower Oil); Olive Oil; Colorant: Beta-Carotene E160a(i)), Garlic, Kosher Salt, Dried Oregano, Black Pepper",,,0.3,2.5,0.5,0.7,1.2
Italian Spinach & White Beans,Stew,"Fresh spinach, white beans and sun-dried tomato mixture over orzo with fresh basil","Water, Marinara Sauce (Tomato Concentrate (water, tomato paste), Onion, Sugar, Garlic, Salt, Carrot Puree, Spices, Citric Acid, Natural Flavorings.), Pasta (SEMOLINA (WHEAT), DURUM WHEAT FLOUR, NIACIN (VITAMIN B3), FERROUS SULPHATE OR FERROUS LACTATE (IRON), THIAMINE MONONITRATE (VITAMIN B1), RIBOFLAVIN (VITAMIN B2), FOLIC ACID.), Great Northern Beans, Water, Celery, Onion, Spinach, Sun Dried Tomato, Banana Peppers (BANANA PEPPERS, WATER, SALT, ACETIC ACID, CITRIC ACID, CALCIUM CHLORIDE, PRESERVATIVES (SODIUM BENZOATE, SODIUM BISULFITE), CAPSICUM OLEORESIN, YELLOW 5. CONTAINS SULFITES.), Garlic, Vegetable Oil Blend (Vegetable Oil (May contain one or more of the following: Soybean, Canola, Corn, Sunflower Oil); Olive Oil; Colorant: Beta-Carotene E160a(i)), Basil, Vegetable Base (SAUTEED VEGETABLE PUREE MIX (CARROTS, ONIONS, CELERY), CORN STARCH, MALTODEXTRIN, VEGETABLE OIL (CORN AND/OR CANOLA OIL), HYDROLYZED CORN PROTEIN, YEAST EXTRACT, TOMATO POWDER, WATER, ONION POWDER, 2% OR LESS OF DISODIUM INOSINATE AND DISODIUM GUANYLATE, SALT, GARLIC POWDER, PAPRIKA (COLOR), NATURAL FLAVORS, LACTIC ACID, NATURAL FLAVOR, MODIFIED CORNSTARCH, CITRIC ACID.), Kosher Salt, Black Pepper",,,1.2,1.2,1.5,0.3,1.0
Vegan Bar Sesame Soy Tofu,Create Your Own,Extra firm tofu marinated in a sesame soy marinade,"Tofu, Cornstarch, Sesame Oil, Soy Sauce, Ginger Root, Brown Sugar, Garlic, Orange Juice, Crushed Red Pepper",,,0.8,0.4,0.6,0.3,1.0
OH Classic Cheese Pizza,"Traditional 16""",House-made pizza dough topped with tomato and fresh basil sauce and a generous layer of melted mozzarella,"All Purpose Flour (Bleached  Wheat Flour, Malted Barley Flour, Niacin, Iron, Potassium Bromate, Thiamin  Mononitrate, Riboflavin, Folic Acid.), Water, Mozzarella Cheese (Low-Moisture Part-Skim Mozzarella Cheese (Pasteurized Part-Skim Milk, Cheese Culture, Salt, Enzymes). Anti-Caking Blend (Potato Starch, Powdered Cellulose).), Crushed Tomatoes (VINE RIPENED TOMATOES, TOMATO PUREE, SEA SALT,  CITRIC ACID.), Extra Virgin Olive Oil, Granulated Sugar, Salt, Basil, Yeast, Kosher Salt, Garlic",,,1.0,1.0,0.2,0.1,2.2
OH Pepperoni Pizza,"Traditional 16""","House-made pizza dough topped with crispy pepperoni slices, tomato fresh basil sauce and mozzarella cheese","All Purpose Flour (Bleached  Wheat Flour, Malted Barley Flour, Niacin, Iron, Potassium Bromate, Thiamin  Mononitrate, Riboflavin, Folic Acid.), Water, Mozzarella Cheese (Low-Moisture Part-Skim Mozzarella Cheese (Pasteurized Part-Skim Milk, Cheese Culture, Salt, Enzymes). Anti-Caking Blend (Potato Starch, Powdered Cellulose).), Crushed Tomatoes (VINE RIPENED TOMATOES, TOMATO PUREE, SEA SALT,  CITRIC ACID.), Deli Pepperoni (CHICKEN, BEEF, TURKEY, SALT, CONTAINS 2% OR LESS OF WATER, DEXTROSE, SPICES, SMOKE FLAVORING, FLAVORING, GARLIC POWDER, OLEORESIN OF PAPRIKA, ROSEMARY EXTRACT, SODIUM ASCORBATE, SPICE EXTRACIVE, CITRIC ACID, LACTIC ACID STARTER CULTURE BHA, BHT, SODIUM NITRITE.  BHA, BHT WITH CITRIC ACID ADDED TO HELP PROTECT FLAVOR. SMOKE FLAVORING ADDED), Extra Virgin Olive Oil, Granulated Sugar, Salt, Basil, Yeast, Kosher Salt, Garlic",,,1.0,1.0,0.2,1.2,2.4
Deluxe Pizza,"Traditional 16""","A hearty combination of onions, mushrooms, pepperoni, sausage, tomato sauce and melted mozzarella","All Purpose Flour, Mozzarella Cheese, Water, Pizza Sauce, Pork Sausage Topping, Deli Pepperoni, Onion, Vegetable Oil Blend, Mushrooms, Vegetable Oil Blend, Kosher Salt, Granulated Sugar, Yeast, Vegetable Oil Blend, Kosher Salt, Kosher Salt, Black Pepper, Black Pepper",,,1.2,1.0,0.4,1.0,2.5
Char-Grilled Turkey Burger,Burger,"White-meat turkey burger served hot-off-the-grill on a fresh, soft bun","Turkey Burger, Roll",,,0.8,0.0,0.0,0.0,2.3
Grilled Black Bean Burger,Burger,"Gardenburger® black bean burger served hot-off-the-grill on a fresh, soft bun","Black Bean Veggie Burger, Roll",,,1.0,0.0,0.5,0.3,2.0
Southern Pimento BCT,Traditional Sandwich,"Crispy bacon, with cucumber, tomato and pimento cheese","Wheatberry Bread, Tomato, Cucumber, Bacon, Red Bell Pepper, Mayonnaise, Cream Cheese, Cheddar Cheese, Kosher Salt, Tabasco Hot Sauce",,,0.8,0.5,0.2,0.6,2.0
Baja Turkey Wrap,Artisan,"Turkey, Guacamole, lettuce, tomato, onion and plant based chipotle mayo on a wrap","Water, Tortilla Variety Pack (Enriched Bleached Flour (Wheat Flour, Niacin, Reduced Iron, Thiamine Mononitrate, Riboflavin, Folic Acid), Water, Vegetable Shortening (Interesterified and Hydrogenated Soybean Oils), contains 2% or less of: Salt, Sodium Acid Pyrophosphate, Baking Soda, Distilled Monoglycerides, Enzymes, Vital Wheat Gluten, Cellulose Gum, Fumaric Acid, and Calcium Propionate and Sorbic Acid (to maintain freshness). TOMATO BASIL SEASONING (Tomato Powder, Spices, Salt, Sugar, Red Bell Pepper, Sun-Dried Tomato, Soybean Oil, Yeast, Onion Powder, Garlic Powder, Natural And Artificial Flavor, Extractives of Paprika); SPINACH HERB SEASONING (Spinach Powder, Onion Powder, Spice, Salt, Garlic Powder, Soybean Oil, Yellow 5 Lake, Blue 1 Lake, Natural And Artificial Flavor), Dextrose, Artificial Flavors, Propylen Glycol, Yellow 5, Blue 1; GARLIC HERB SEASONING (Sugar, Corn Maltodextrin, Salt, Modified Corn Starch, Spices, Dehydrated Garlic, Red Bell Pepper, Medium Chain Triglycerides, Dehydrated Tomato, Natural and Artificial Flavor, Onion powder).), Tomato, Vegan Mayonnaise (CANOLA OIL, WATER, SOYBEAN OIL, SUGAR, DISTILLED VINEGAR, SALT, CONTAINS 2% OR LESS OF EACH OF THE FOLLOWING: MODIFIED FOOD STARCH (CORN, POTATO), LEMON JUICE CONCENTRATE, NATURAL FLAVOR, CALCIUM DISODIUM EDTA (USED TO PROTECT QUALITY), PAPRIKA OLEORESIN.), Deli Turkey Breast, Onion, Kosher Salt, Guacamole (Hass Avocados, Distilled Vinegar, Contains 2% Or Less Of: Water, Jalapeño Peppers, Salt, Dehydrated Onion, Granulated Garlic, Erythorbic Acid (To Maintain Color), Sugar, Citric Acid (To Acidify).), Cider Vinegar, Lettuce, Brown Sugar, Chipotle Peppers in Sauce (WATER, TOMATO PASTE, DRIED CHIPOTLE PEPPERS, DISTILLED VINEGAR, CORN OIL, CONTAINS 2% OR LESS OF IODIZED SALT (CONTAINS POTASSIUM IODATE), CORN STARCH, ONION POWDER, GARLIC POWDER, SPICES.), Mint, Thyme, Lime Juice, Kosher Salt, Rosemary, Cilantro",,,0.8,0.8,0.2,1.5,1.8
Boardwalk Tofu Wrap,Artisan,Italian seasoned tofu and spicy pepper relish on a spinach wrap,"Spinach Herb Tortilla, Tofu, Cherry Peppers, Banana Peppers, Roasted Red Peppers, Red Wine Vinegar, Pickle , Onion, Italian Seasoning, Garlic Powder, Kosher Salt",,,0.8,0.7,0.6,1.8,1.5
Corner Chicken Salad Croissant,Artisan,Creamy chicken salad with lettuce & tomato on a buttery croissant,"Croissant, Chicken, Tomato, Mayonnaise, Cucumber, Celery, Lettuce, Dijon Mustard, Lemon Juice, Black Pepper",,,0.8,0.4,0.0,0.0,2.6
Cavalier Club,Club,"Turkey, Ham, Bacon, lettuce, tomato & herb cream cheese layered on toasted artisan country white bread","Sour Dough Bread, Water, Bacon, Lettuce, Deli Ham, Tomato, Deli Turkey Breast, Onion, Kosher Salt, Cream Cheese, Brown Sugar, Mint, Lemon Juice, Thyme, Green Onion, Parsley, Rosemary, Garlic, Dried Tarragon, Basil, Kosher Salt, Crushed Red Pepper",,,0.7,0.3,0.1,0.1,2.7
Mediterranean Topped Hummus,Salad Entrée,"Creamy hummus topped with tabbouleh, tomato, Kalamata olives, feta and tzatziki sauce with puffy pita","Garbanzo Beans, Flat Bread (WHOLE WHEAT FLOUR, ENRICHED UNBLEACHED WHEAT FLOUR (WHEAT FLOUR,MALTED BARLEY FLOUR, ASCORBIC ACID ADDED AS A DOUGH CONDITIONER, NIACIN,REDUCED IRON, THIAMINE MONONITRATE, RIBOFLAVIN, FOLIC ACID), WATER, SOYBEANOIL, YEAST, CONTAINS LESS THAN 2% OF THE FOLLOWING: SUGAR, NONFAT DRY MILK,WHEAT GLUTEN, SALT, LEAVENING (SODIUM ACID PYROPHOSPHATE, BAKING SODA,MONOCALCIUM PHOSPHATE), SODIUM STEAROYL LACTYLATE, GUAR GUM.), Tomato, Water, Lemon Juice, Tahini (SESAME SEEDS.), Bulgar Wheat, Tomato , Feta Cheese (Feta Cheese (Pasteurized Part-Skim Milk, Cheese Culture, Salt, Enzymes). Anti-Caking Blend (Powdered Cellulose, Natamycin [A Natural Mold Inhibitor]).), Kalamata Olives, Vegetable Oil Blend (Vegetable Oil (May contain one or more of the following: Soybean, Canola, Corn, Sunflower Oil); Olive Oil; Colorant: Beta-Carotene E160a(i)), Sour Cream (Cultured Non-Fat Milk, Cream, Contains Less than 2% of: Whey, Food Starch-Modified (Corn), Sodium Phosphate (Sodium Tripolyphosphate), Guar Gum, Carrageenan, Calcium Sulfate, Locust Bean Gum, Potassium Sorbate (preservative).), Plain Non-Fat Greek Yogurt (CULTURED GRADE A NON FAT MILK, LIVE & ACTIVE  CULTURES S. THERMOPHILUS AND L. BULGARICUS.), Parsley, Lemon Juice, Cucumber, Vegetable Oil Blend (Vegetable Oil (May contain one or more of the following: Soybean, Canola, Corn, Sunflower Oil); Olive Oil; Colorant: Beta-Carotene E160a(i)), Green Onion, Mint, Garlic, Lemon Juice, Kosher Salt, Garlic, Dill, Kosher Salt, Black Pepper, Kosher Salt, Garlic, Black Pepper",,,0.8,1.2,0.7,0.2,1.4
Meze Tomato Cucumber Salad,Side Salad,Plum tomatoes and cucumbers tossed in lemon herb dressing,"Cucumber, Tomato, Extra Virgin Olive Oil, Red Wine Vinegar, Water, Lemon Juice, Garlic, Basil, Parsley, Kosher Salt, Dried Oregano, Black Pepper",,,0.5,2.0,0.2,0.1,0.4
Seasoned Spinach,Vegetables - Green,Steamed spinach lightly seasoned with salt and pepper,"Spinach, Margarine, Kosher Salt, Black Pepper",,,0.1,0.0,1.8,0.2,0.3
Roasted Cauliflower,Vegetables - Non-Green,Fresh cauliflower seasoned and roasted,"Cauliflower, Vegetable Oil Blend (Vegetable Oil (May contain one or more of the following: Soybean, Canola, Corn, Sunflower Oil); Olive Oil; Colorant: Beta-Carotene E160a(i)), Kosher Salt, Black Pepper",,,0.4,0.0,1.0,0.2,1.2
Roasted Mushrooms,Vegetables - Non-Green,"Sliced mushrooms roasted with oil, salt and pepper","Mushrooms, Canola Oil, Kosher Salt, Black Pepper",,,0.2,0.0,1.2,0.3,1.3
Green Chili Calabacitas,Vegetables - Non-Green,Sautéed zucchini with corn and green chilies,"Squash Zucchini, Corn Kernels, Green Chili Peppers, Onion, Canola Oil, Garlic, Kosher Salt, Black Pepper",,,1.2,0.2,0.4,1.8,0.8
Char-Grilled Garden Vegetables,Vegetables - Non-Green,"Grilled seasoned zucchini, yellow squash, eggplant, onions and red peppers","Red Bell Pepper, Squash Zucchini, Eggplant, Squash, Onion, Canola Oil, Montreal Steak Seasoning (COARSE SALT, SPICES (INCLUDING BLACK PEPPER AND RED PEPPER), GARLIC, ONION, SUNFLOWER OIL, NATURAL FLAVOR AND EXTRACTIVES OF PAPRIKA.)",,,1.0,0.1,0.6,0.4,1.2
Tuscan White Bean Salad,Composed Salad,"White beans, bell peppers, green onions and fresh basil and parsley tossed in a balsamic vinaigrette","Great Northern Beans, Balsamic Vinaigrette Dressing, Red Bell Pepper, Celery, Green Onion, Parsley, Basil, Kosher Salt, Black Pepper",,,1.0,1.7,0.6,0.2,1.0
Roasted Shawarma Chickpeas,Legumes,"Crispy, roasted shawarma-seasoned chickpeas","Garbanzo Beans, Vegetable Oil Blend (Vegetable Oil (May contain one or more of the following: Soybean, Canola, Corn, Sunflower Oil); Olive Oil; Colorant: Beta-Carotene E160a(i)), Kosher Salt, Cumin, Garlic Powder, Paprika, Kosher Salt, Black Pepper, Coriander, Allspice, Turmeric, Cinnamon",,,0.6,0.4,0.8,2.0,2.0
Brown Rice & Lentils,Rice,Cooked brown rice and lentils,"Water, Water, Whole Grain Brown Rice, Lentil",,,0.3,0.0,0.2,0.0,2.3
Roasted Garlic Rice,Rice,White rice with roasted garlic,"Water, White Rice, Garlic, Canola Oil, Canola Oil, Kosher Salt, Black Pepper",,,0.3,0.0,0.1,0.2,2.6
Crispy Shoestring French Fries,Potato,Piping hot crispy shoestring French fries,"French Fries (Potatoes, Vegetable Oil (Contains One Or More Of The Following Oils: Canola, Soybean, Cottonseed, Sunflower, Corn), Potato Starch - Modified. Contains 2% or less of Dextrin, Dextrose, Leavening (Sodium Acid Pyrophosphate, Sodium Bicarbonate), Pea Fiber, Pea Protein, Rice Flour, Salt, Sodium Acid Pyrophosphate Added To Maintain Color, Xanthan Gum.)",,,0.2,0.0,0.0,0.1,4.2
Herb Roasted Red Potatoes,Potato,"Roasted quartered red potatoes tossed with rosemary, thyme and marjoram","Red Potato, Vegetable Oil Blend (Vegetable Oil (May contain one or more of the following: Soybean, Canola, Corn, Sunflower Oil); Olive Oil; Colorant: Beta-Carotene E160a(i)), Kosher Salt, Dried Rosemary, Black Pepper, Dried Thyme Leaf, Dried Marjoram Leaf",,,0.3,0.0,0.1,0.2,2.8
Grilled Cumin Lime Chicken,POULTRY ENTREE,"Tender boneless chicken marinated in lime juice, cumin, and garlic","Chicken Breast (Boneless skinless chicken breast filets with rib meat CONTAINING: Up to 15% of a solution of water, sea salt.), Lime Juice, Cumin, Vegetable Oil Blend (Vegetable Oil (May contain one or more of the following: Soybean, Canola, Corn, Sunflower Oil); Olive Oil; Colorant: Beta-Carotene E160a(i)), Garlic, Cayenne Pepper",,,0.2,1.8,0.2,1.2,1.4
Shredded Cheddar Cheese,Meat/Cheese/Egg/Protein/Nut (MTO),Shredded Cheddar cheese,,,,0.2,0.1,0.0,0.0,1.8
Black Beans,Meat/Cheese/Egg/Protein/Nut (MTO),Black beans,,,,0.4,0.0,0.4,0.0,2.0
Chopped Hard-Cooked Egg,Meat/Cheese/Egg/Protein/Nut (MTO),Chopped hard-cooked egg,,,,0.1,0.0,0.0,0.0,1.2
Swiss Cheese,Meat/Cheese/Egg/Protein/Nut (MTO),Sliced Swiss cheese,,,,0.1,0.0,0.0,0.0,1.5
Provolone Cheese,Meat/Cheese/Egg/Protein/Nut (MTO),Sliced provolone,,,,0.1,0.0,0.0,0.0,1.5
American Cheese,Meat/Cheese/Egg/Protein/Nut (MTO),Sliced American cheese,,,,0.2,0.0,0.0,0.0,1.4
Pepper Jack Cheese,Meat/Cheese/Egg/Protein/Nut (MTO),Sliced Monterey Jack cheese with hot chile peppers,,,,0.1,0.0,0.0,1.8,1.4
O'Hill Smash Burger*,Meat/Cheese/Egg/Protein/Nut (MTO),Juicy burger pressed with American cheese on a Martin's potato roll,"Ground Beef, Hamburger Roll (Unbleached Enriched Wheat Flour (flour, Ferrous Sulfate, Niacin, Thiamin, Riboflavin, Folic Acid), Nonfat Milk, Reconstituted Potatoes (from Potato Flour), Yeast, Sugar, Cane Sugar Syrup, Wheat Gluten, Sunflower Oil, Contains 2 Percent Or Less Of Each Of The Following: Salt, Butter, Dough Conditioners (sodium Stearoyl Lactylate, Monoglycerides And Diglycerides), Monocalcium Phosphate, Cultured Wheat Flour, Calcium Propionate (a Preservative), Guar Gum, Ascorbic Acid, Datem, Calcium Sulfate, Enzymes, Turmeric Color, Annatto Color, Sesame Seeds.), American Cheese (American Cheese (Milk, Cheese Culture, Salt, Enzymes), Water, Cream, Potassium Citrate, Sodium Citrate, Sorbic Acid As A Preservative, Color Added, Sunflower Lecithin (Release Agent).), Kosher Salt, Black Pepper",,,0.8,0.1,0.0,0.1,2.6
Chopped Fresh Spinach,Meat/Cheese/Egg/Protein/Nut (MTO),Chopped fresh spinach,,,,0.1,0.0,2.0,0.0,0.5
Goldfish® Crackers,Breads/Grains/Pasta/Cereal (MTO),Cheese-flavored Goldfish® Crackers,,,,0.6,0.0,0.0,0.0,4.6
Croutons,Breads/Grains/Pasta/Cereal (MTO),Homestyle seasoned croutons,,,,0.3,0.0,0.1,0.2,4.7
Smoky Chipotle Mayo,Spread,Vegan mayonnaise blended with chipotle peppers and cider vinegar,"Vegan Mayonnaise (CANOLA OIL, WATER, SOYBEAN OIL, SUGAR, DISTILLED VINEGAR, SALT, CONTAINS 2% OR LESS OF EACH OF THE FOLLOWING: MODIFIED FOOD STARCH (CORN, POTATO), LEMON JUICE CONCENTRATE, NATURAL FLAVOR, CALCIUM DISODIUM EDTA (USED TO PROTECT QUALITY), PAPRIKA OLEORESIN.), Cider Vinegar, Chipotle Peppers in Sauce (WATER, TOMATO PASTE, DRIED CHIPOTLE PEPPERS, DISTILLED VINEGAR, CORN OIL, CONTAINS 2% OR LESS OF IODIZED SALT (CONTAINS POTASSIUM IODATE), CORN STARCH, ONION POWDER, GARLIC POWDER, SPICES.), Kosher Salt",,,0.4,0.8,0.3,2.4,0.8
Sliced Red Onions,Fruit/Vegetable/Herb/Salad (MTO),Thinly sliced red onions,,,,0.7,0.3,0.5,0.2,0.4
Feta Cheese Crumbles,Fruit/Vegetable/Herb/Salad (MTO),Crumbled feta,,,,0.1,1.2,0.0,0.0,1.3
Romaine Lettuce,Fruit/Vegetable/Herb/Salad (MTO),Chopped romaine lettuce,,,,0.1,0.0,0.8,0.0,0.2
Grape Tomatoes,Fruit/Vegetable/Herb/Salad (MTO),Fresh grape tomatoes,,,,1.5,1.0,0.1,0.0,0.2
Sliced Green Bell Peppers,Fruit/Vegetable/Herb/Salad (MTO),Sliced green bell peppers,,,,0.8,0.1,0.7,0.0,0.4
Roasted Corn,Fruit/Vegetable/Herb/Salad (MTO),Roasted corn tossed with salt and pepper,,,,2.2,0.0,0.0,0.1,1.0
Sliced Red Bell Peppers,Fruit/Vegetable/Herb/Salad (MTO),Sliced red bell peppers,,,,1.5,0.1,0.1,0.0,0.3
Shredded Carrots,Fruit/Vegetable/Herb/Salad (MTO),Shredded fresh carrots,,,,2.0,0.0,0.0,0.0,0.4
Spring Salad Mix,Fruit/Vegetable/Herb/Salad (MTO),Fresh spring lettuce mix,,,,0.3,0.0,0.9,0.0,0.2
Pickled Red Onion,Fruit/Vegetable/Herb/Salad (MTO),Thinly sliced red onion pickled with red wine vinegar,,,,0.6,2.8,0.2,0.0,0.3
Green Leaf Lettuce,Fruit/Vegetable/Herb/Salad (MTO),Green whole leaf lettuce,,,,0.1,0.0,0.7,0.0,0.2
Sliced Tomatoes,Fruit/Vegetable/Herb/Salad (MTO),Sliced fresh tomatoes,,,,1.3,0.9,0.0,0.0,0.2
Caramelized Onions,Fruit/Vegetable/Herb/Salad (MTO),Sliced onions slowly sauteed until golden,,,,3.2,0.0,0.1,0.0,0.8
Sliced Cucumber,Fruit/Vegetable/Herb/Salad (MTO),Sliced fresh cucumber,,,,0.3,0.0,0.0,0.0,0.1
Chilled Roasted Mushrooms,Fruit/Vegetable/Herb/Salad (MTO),Chilled roasted fresh button mushrooms tossed with garlic and herbs,,,,0.2,0.0,1.0,0.2,1.0
Dill Pickle Slices,Condiments/Spreads/Dressings/Sauces/Salsas (MTO),Dill pickle slices,"Pickle Slices (FRESH  CUCUMBERS, WATER, SALT, DISTILLED VINEGAR, CONTAINS LESS THAN 2% OF DRIED  GARLIC, CALCIUM CHLORIDE, SPICE, SODIUM BENZOATE (TO PRESERVE FLAVOR),  MUSTARD SEED, DRIED RED PEPPERS, NATURAL FLAVOR, POLYSORBATE 80, OLEORESIN  TURMERIC)",,,0.2,3.6,0.1,0.0,0.2
Green Goddess Dressing,Condiments/Spreads/Dressings/Sauces/Salsas (MTO),"Creamy, herb-infused plant-based mayo dressing","Vegan Mayonnaise (CANOLA OIL, WATER, SOYBEAN OIL, SUGAR, DISTILLED VINEGAR, SALT, CONTAINS 2% OR LESS OF EACH OF THE FOLLOWING: MODIFIED FOOD STARCH (CORN, POTATO), LEMON JUICE CONCENTRATE, NATURAL FLAVOR, CALCIUM DISODIUM EDTA (USED TO PROTECT QUALITY), PAPRIKA OLEORESIN.), Lemon Juice, Green Onion, Dried Tarragon, Parsley, Kosher Salt, Black Pepper",,,0.3,0.3,0.6,0.1,0.1
Greek Dressing,Condiments/Spreads/Dressings/Sauces/Salsas (MTO),Herb vinaigrette with lemon and feta,"Vegetable Oil Blend (Vegetable Oil (May contain one or more of the following: Soybean, Canola, Corn, Sunflower Oil); Olive Oil; Colorant: Beta-Carotene E160a(i)), Red Wine Vinegar, Lemon Juice, Granulated Sugar, Feta Cheese (Feta Cheese (Pasteurized Part-Skim Milk, Cheese Culture, Salt, Enzymes). Anti-Caking Blend (Powdered Cellulose, Natamycin [A Natural Mold Inhibitor]).), Garlic, Mint, Kosher Salt, Black Pepper, Dried Oregano",,,0.2,2.2,0.1,0.1,0.1
Lite Italian Dressing,Condiments/Spreads/Dressings/Sauces/Salsas (MTO),Lite Italian salad dressing,,,,0.6,2.0,0.1,0.1,0.1
Balsamic Vinaigrette,Condiments/Spreads/Dressings/Sauces/Salsas (MTO),Tangy balsamic vinaigrette dressing,,,,1.8,2.2,0.1,0.0,0.1
Ranch Dressing,Condiments/Spreads/Dressings/Sauces/Salsas (MTO),Homestyle creamy ranch salad dressing,,,,0.2,0.1,0.0,0.0,0.1
Mayonnaise,Condiments/Spreads/Dressings/Sauces/Salsas (MTO),Mayonnaise,,,,0.1,0.0,0.0,0.0,0.1
Honey Mustard Dressing,Condiments/Spreads/Dressings/Sauces/Salsas (MTO),Honey mustard salad dressing,,,,2.7,1.0,0.0,0.2,0.1
Dijon Mustard,Condiments/Spreads/Dressings/Sauces/Salsas (MTO),Dijon mustard,,,,0.2,1.2,0.1,1.5,0.1
Burger Sauce,Condiments/Spreads/Dressings/Sauces/Salsas (MTO),"Creamy blend of mayonnaise, ketchup, sweet pickle relish, Worcestershire and hot pepper sauce",,,,1.4,1.3,0.1,0.4,0.2
Fat-Free French Dressing,Condiments/Spreads/Dressings/Sauces/Salsas (MTO),Fat-free French salad dressing,,,,1.8,2.0,0.0,0.0,0.1
Lemon Tahini Dressing,Salad Dressing,"A blend of tahini, fresh lemon juice, garlic, parsley and cumin","Water, Tahini (SESAME SEEDS.), Lemon Juice, Parsley, Garlic, Cumin, Kosher Salt",,,0.3,2.0,0.8,0.3,0.1
