name,category,description,ingredients,diet_tags,allergens,sweet,salty,savory,spicy,sour,rich
Scrambled Just® Egg,Omelet/Quiche/Frittata/Strata,Scrambled Just® egg seasoned with salt & pepper,"Plant Based Egg (Water, Mung Bean Protein, Expeller-Pressed Canola Oil, Contains less than 2% of Dehydrated Onion, Gellan Gum, Carrot Extractives (color), Turmeric Extractives (color), Potassium Citrate, Salt, Sugar, Tapioca Syrup Solids, Tetrasodium Pyrophosphate, Transglutaminase, Nisin (preservative).), Canola Oil, Kosher Salt, Black Pepper",,,2.1,2.9,3.5,2.0,0.5,1.5
Scrambled Eggs,Omelet/Quiche/Frittata/Strata,Eggs gently scrambled to fluffy perfection,"Egg Blend (WHOLE EGGS, 19.0% WATER. CONTAINS 2% OR LESS OF THE FOLLOWING: SALT, XANTHAN GUM, CITRIC ACID, ANNATTO (COLOR), BUTTER FLAVOR (SUNFLOWER OIL, NATURAL FLAVORS, MEDIUM CHAIN TRIGLYCERIDES).)",,,1.1,4.1,4.1,0.8,0.1,5.0
"Bacon, Egg & Cheese Biscuit",Breakfast,"Scrambled eggs, American cheese and crisp bacon on a fresh baked biscuit","Biscuit (ENRICHED FLOUR BLEACHED (WHEAT FLOUR, NIACIN, FERROUS SULFATE, THIAMIN MONONITRATE, RIBOFLAVIN, FOLIC ACID), WATER, SOYBEAN OIL, HYDROGENATED SOYBEAN OIL, BUTTERMILK, SUGAR, SODIUM ALUMINUM PHOSPHATE, SALT, BAKING SODA, DATEM, CALCIUM ACID PYROPHOSPHATE, POTASSIUM BICARBONATE, WHEAT PROTEIN ISOLATE, PECTIN, CREAM, NATURAL FLAVOR.), Egg Blend (WHOLE EGGS, 19.0% WATER. CONTAINS 2% OR LESS OF THE FOLLOWING: SALT, XANTHAN GUM, CITRIC ACID, ANNATTO (COLOR), BUTTER FLAVOR (SUNFLOWER OIL, NATURAL FLAVORS, MEDIUM CHAIN TRIGLYCERIDES).), Bacon (Pork Cured With: Water, Salt, Sugar, Sodium Phosphates, Sodium Erythorbate, Sodium Nitrite.), American Cheese (American Cheese (Milk, Cheese Culture, Salt, Enzymes), Water, Cream, Potassium Citrate, Sodium Citrate, Sorbic Acid As A Preservative, Color Added, Sunflower Lecithin (Release Agent).)",,,2.6,4.5,4.7,0.4,1.2,4.7
Pork Sausage Links,Breakfast Meat,Golden brown savory pork sausage link,"Sausage (Pork, Pork Broth, Contains 2% or Less of: Salt, Dextrose, Flavorings, BHT, Citric Acid, Propyl Gallate, Packed in Beef Collagen Casing.)",,,1.2,5.0,3.2,0.6,0.5,3.3
Turkey Bacon,Breakfast Meat,Crispy turkey bacon strip,"Turkey Bacon (Turkey, Water, Sugar, 2% or less of Salt, Canola Oil, Sun flower Oil, Natural Flavor, Sodium Phosphate, Potassium Diacetate, Potassium Acetate, Smoke Flavor, Sodium Erythorbate, Sodium Nitrite.)",,,3.4,5.0,3.0,1.3,1.5,3.4
O'Brien Potatoes,Potato,Pan-fried seasoned diced potatoes and sautéed green and red peppers and onions,"Potatoes, Canola Oil, Green Bell Pepper, Onion, Red Bell Pepper, Kosher Salt, Black Pepper",,,0.4,4.2,5.0,2.7,1.1,4.9
Hash Browns,Potato,Pan-fried seasoned shredded potatoes,"Hash Brown Potato (Potatoes.  Contains 2% or less of Dextrose, Sodium Acid Pyrophosphate Added To Maintain Color.), Canola Oil, Kosher Salt, Black Pepper",,,0.9,4.1,3.9,3.3,0.8,4.8
Pancake,Pancakes/Waffles/French Toast,"Pancake using oat milk, rice flour and egg replacer","Oat Milk (Oat base (water, oats), low erucic acid rapeseed oil. Contains 2% or less of: dipotassium phosphate, calcium carbonate, tricalcium phosphate, sea salt, dicalcium phosphate, riboflavin, vitamin A acetate, vitamin D2, vitamin B12), Rice Flour (Sweet White Rice Flour, Whole Grain Brown Rice Flour, Potato Starch, Whole Grain Sweet White Sorghum Flour, Tapioca Flour, Xanthan Gum.), Egg Substitute (Potato Starch, Tapioca Flour, Baking Soda, Psyllium Husk Powder), Baking Powder, Granulated Sugar, Baking Soda, Pure Vanilla Extract, Kosher Salt",,,5.0,3.1,4.3,0.4,1.0,1.7
French Toast,Pancakes/Waffles/French Toast,Golden brown and fluffy cinnamon-spiced thick-cut French toast,"Texas Toast (UNBLEACHED ENRICHED FLOUR (WHEAT FLOUR, MALTED BARLEY FLOUR, NIACIN, REDUCED IRON, THIAMIN MONONITRATE, RIBOFLAVIN, FOLIC ACID), WATER, HIGH FRUCTOSE CORN SYRUP, WHEAT GLUTEN, CONTAINS 2% OR LESS OF EACH OF THE FOLLOWING: YEAST, SALT, DOUGH CONDITIONERS (CONTAINS ONE OR MORE OF THE FOLLOWING: SODIUM STEAROYL LACTYLATE, CALCIUM STEAROYL LACTYLATE, MONOGLYCERIDES, MONO- AND DIGLYCERIDES, DISTILLED MONOGLYCERIDES, CALCIUM PEROXIDE, CALCIUM IODATE, DATEM, ETHOXYLATED MONO- AND DIGLYCERIDES, ENZYMES, ASCORBIC ACID), SOYBEAN OIL, YELLOW CORN FLOUR, MONOCALCIUM PHOSPHATE, COLORED WITH ANNATTO AND TURMERIC, WHEAT STARCH, CALCIUM SULFATE, SOY LECITHIN, CALCIUM PROPIONATE (TO RETARD SPOILAGE).), Egg Blend (WHOLE EGGS, 19.0% WATER. CONTAINS 2% OR LESS OF THE FOLLOWING: SALT, XANTHAN GUM, CITRIC ACID, ANNATTO (COLOR), BUTTER FLAVOR (SUNFLOWER OIL, NATURAL FLAVORS, MEDIUM CHAIN TRIGLYCERIDES).), Reduced Fat Milk, Granulated Sugar, Pure Vanilla Extract, Cinnamon, Nutmeg",,,2.6,3.5,3.4,0.4,0.6,5.0
Triple Chocolate Donut,Yeast Bread,"Donut topped with chocolate icing, chocolate glaze and chocolate sprinkles","Donut , Chocolate Buttercream Icing , Sprinkles, Powdered Sugar, Water, Baking Cocoa, Pure Vanilla Extract",,,5.0,2.6,2.5,0.2,0.2,4.9
Southern Biscuit,Biscuit,"Freshly baked warm, flaky biscuit","Biscuit (ENRICHED FLOUR BLEACHED (WHEAT FLOUR, NIACIN, FERROUS SULFATE, THIAMIN MONONITRATE, RIBOFLAVIN, FOLIC ACID), WATER, SOYBEAN OIL, HYDROGENATED SOYBEAN OIL, BUTTERMILK, SUGAR, SODIUM ALUMINUM PHOSPHATE, SALT, BAKING SODA, DATEM, CALCIUM ACID PYROPHOSPHATE, POTASSIUM BICARBONATE, WHEAT PROTEIN ISOLATE, PECTIN, CREAM, NATURAL FLAVOR.)",,,1.7,4.0,2.3,0.7,0.3,4.3
Old Fashioned Oatmeal,Cereal,Homestyle oatmeal cereal,"Water, Oatmeal",,,0.6,1.4,3.6,1.2,0.7,2.8
Overnight Oats,Cereal,"A creamy combination of oatmeal, milk, yogurt and honey. ","Plain Non-Fat Greek Yogurt (CULTURED GRADE A NON FAT MILK, LIVE & ACTIVE  CULTURES S. THERMOPHILUS AND L. BULGARICUS.), Reduced Fat Milk, Honey, Oatmeal, Cinnamon, Pure Vanilla Extract, Kosher Salt",,,2.2,3.0,3.5,0.6,3.5,5.0
Mixed Berry Cucumber Smoothie,COLD - BEVERAGES,Mixed Berry Cucumber Smoothie,"Mixed Berries, Ice Cubes, Apple Juice, Water, Cucumber",,,0.9,2.1,2.2,1.2,1.0,1.7
Fontana Cinnamon Coffee Cake,QUICK BREADS,Freshly baked coffee cake with streusel crumb topping,"Wheat Flour, Low-Fat Buttermilk, Brown Sugar, Unsalted Butter, Granulated Sugar, Liquid Egg Whites, Unsalted Butter, Wheat Flour, Brown Sugar, Granulated Sugar, Oatmeal, Baking Powder, Pure Vanilla Extract, Cinnamon, Baking Soda, Kosher Salt, Cinnamon, Kosher Salt",,,5.0,3.9,3.4,0.3,1.0,3.3
Smoked Chicken Apple Sausage,Meat/Cheese/Egg/Protein/Nut (MTO),Smoked chicken apple sausage,"Chicken Apple Sausage Link ((chicken thigh meat with skin, chicken breast meat with rib meat, water, contains 2% or less of salt, spices, dextrose, sugar, yeast extract, natural flavors, lactic acid. in collagen casing))",,,2.6,5.0,3.9,1.0,0.8,1.8
Egg Whites,Meat/Cheese/Egg/Protein/Nut (MTO),Liquid egg whites,,,,0.1,2.0,4.3,0.4,1.2,3.0
Shredded Cheddar Cheese,Meat/Cheese/Egg/Protein/Nut (MTO),Shredded Cheddar cheese,,,,0.5,1.6,2.0,0.7,0.0,4.7
Eggs,Meat/Cheese/Egg/Protein/Nut (MTO),Ready-to-use blended eggs,,,,0.4,1.1,3.5,1.2,0.1,2.3
Cottage Cheese,Meat/Cheese/Egg/Protein/Nut (MTO),Creamy cottage cheese,,,,0.5,1.0,3.4,1.5,0.7,4.2
Nonfat Strawberry Yogurt,Meat/Cheese/Egg/Protein/Nut (MTO),Creamy nonfat strawberry yogurt,,,,1.3,1.2,3.0,1.3,3.3,4.2
Nonfat Vanilla Yogurt,Meat/Cheese/Egg/Protein/Nut (MTO),Nonfat creamy vanilla yogurt,,,,1.4,1.7,2.1,1.4,2.1,3.4
Chia Quinoa Crunch,Meat/Cheese/Egg/Protein/Nut (MTO),Sweet and toasty quinoa and chia seed crunch,,,,2.3,2.7,2.0,0.4,1.2,2.2
Nonfat Greek Yogurt,Meat/Cheese/Egg/Protein/Nut (MTO),Nonfat Greek yogurt,,,,1.2,1.2,4.0,0.9,3.2,1.4
Toasted Sunflower Seeds,Meat/Cheese/Egg/Protein/Nut (MTO),Toasted sunflower seeds,,,,0.2,2.3,3.0,0.1,0.1,2.3
Chopped Fresh Spinach,Meat/Cheese/Egg/Protein/Nut (MTO),Chopped fresh spinach,,,,1.4,3.0,3.1,0.9,0.1,2.1
Honey Granola,Breads/Grains/Pasta/Cereal (MTO),"Crunchy cinnamon-spiced, honey-coated oats",,,,2.6,2.5,2.4,0.7,1.3,2.2
Toasted Coconut,Dessert/Dessert Topping (MTO),Toasted coconut flakes,,,,0.5,2.7,2.5,0.8,0.8,1.2
Fresh Fruit Salad,Fruit/Vegetable/Herb/Salad (MTO),"Fresh melon, pineapple and grapes","Honeydew, Cantaloupe, Red Grapes, Pineapple",,,2.3,2.4,3.9,1.4,0.7,1.0
Sliced Mushrooms,Fruit/Vegetable/Herb/Salad (MTO),Sliced fresh mushrooms,,,,1.3,2.5,3.4,0.6,0.2,3.1
Diced Onions,Fruit/Vegetable/Herb/Salad (MTO),Diced yellow onions,,,,0.0,2.5,3.5,0.3,0.5,2.7
Sliced Mixed Bell Peppers,Fruit/Vegetable/Herb/Salad (MTO),Sliced green and red bell peppers,,,,1.2,2.6,2.7,3.6,0.1,2.9
Diced Tomatoes,Fruit/Vegetable/Herb/Salad (MTO),Diced fresh tomatoes,,,,0.2,1.8,2.8,0.4,0.7,2.4
Toasted Pumpkin Seeds,Fruit/Vegetable/Herb/Salad (MTO),Crunchy pumpkin seeds,,,,0.7,2.7,2.7,0.8,0.1,1.6
Dried Cranberries,Fruit/Vegetable/Herb/Salad (MTO),Sweet-tart dried cranberries,,,,2.3,1.3,2.2,1.2,0.8,1.2
Fresh Fruit Salad,Fruit/Vegetable/Herb/Salad (MTO),"Fresh honey dew, cantaloupe, pineapple and grapes",,,,2.4,1.2,2.4,1.0,1.2,1.5
"GRAVY, SAUSAGE, MIX wr",Gravy,Southern Sausage Gravy ,"Water, Sausage Patty (Pork, Contains 2% or Less of: Water, Salt, Corn Syrup Solids, Flavorings, Sugar, Dextrose, BHT, Propyl Gallate, Citric Acid.), Gravy Mix (MALTODEXTRIN, WHEY, BLEACHED ENRICHED FLOUR (WHEAT FLOUR, NIACIN, REDUCED IRON, THIAMINE MONONITRATE, RIBOFLAVIN, FOLIC ACID), MODIFIEDCORNSTARCH, CANOLA OIL, SOYBEAN OIL, SKIM MILK, TAPIOCA STARCH, SALT, 2% OR LESS OF HYDROLYZED SOY, CORN AND WHEAT PROTEINS, SODIUM CASEINATE, XANTHAN GUM, SPICES, SUGAR, YEAST EXTRACT, CITRIC ACID, DISODIUM INOSINATE, NATURAL FLAVORS, DEXTROSE, DISODIUM GUANYLATE), Tabasco Hot Sauce (DISTILLED VINEGAR, RED PEPPER, SALT.), Black Pepper",,,2.0,5.0,4.0,2.7,3.0,2.4
