name,category,description,ingredients,diet_tags,allergens,sweet,salty,savory,spicy,sour,rich
Hard-Cooked Egg,Omelet/Quiche/Frittata/Strata,"Perfectly hard-cooked egg, featuring a firm yet tender white and a rich, creamy yolk","Water, Egg",,,1.3,2.5,4.8,1.4,0.3,5.0
Scrambled Just® Egg,Omelet/Quiche/Frittata/Strata,Scrambled Just® egg seasoned with salt & pepper,"Plant Based Egg (Water, Mung Bean Protein, Expeller-Pressed Canola Oil, Contains less than 2% of Dehydrated Onion, Gellan Gum, Carrot Extractives (color), Turmeric Extractives (color), Potassium Citrate, Salt, Sugar, Tapioca Syrup Solids, Tetrasodium Pyrophosphate, Transglutaminase, Nisin (preservative).), Canola Oil, Kosher Salt, Black Pepper",,,1.9,2.6,3.9,2.8,1.5,1.8
Scrambled Eggs,Omelet/Quiche/Frittata/Strata,Eggs gently scrambled to fluffy perfection,"Egg Blend (WHOLE EGGS, 19.0% WATER. CONTAINS 2% OR LESS OF THE FOLLOWING: SALT, XANTHAN GUM, CITRIC ACID, ANNATTO (COLOR), BUTTER FLAVOR (SUNFLOWER OIL, NATURAL FLAVORS, MEDIUM CHAIN TRIGLYCERIDES).)",,,1.3,4.1,4.4,1.0,0.9,3.0
Roasted Pepper Pita,Breakfast,"Roasted mixed peppers, feta cheese, egg and tzatziki sauce on white pita","Pita Bread, Egg Blend, Red Bell Pepper, Green Bell Pepper, Feta Cheese, Tzatziki, Vegetable Oil Blend, Vegetable Oil Blend, Kosher Salt",,,0.9,4.5,4.0,3.6,0.0,4.4
Turkey Sausage Link,Breakfast Meat,Golden brown savory turkey sausage link,"Turkey Sausage (Turkey, Mechanically Separated Turkey, Water, Seasoning (Salt, Spices, Corn Syrup Solids, Spice Extractives, BHA, BHT, Citric Acid), Natural Flavoring. In a Calcium Alginate Casing.)",,,3.1,5.0,3.4,0.7,0.5,1.2
Pork Sausage Patty,Breakfast Meat,Sizzling hot golden brown pork sausage patty,"Sausage Patty (Pork, Contains 2% or Less of: Water, Salt, Corn Syrup Solids, Flavorings, Sugar, Dextrose, BHT, Propyl Gallate, Citric Acid.)",,,3.5,4.5,3.6,0.3,0.9,1.9
O'Brien Potatoes,Potato,Pan-fried seasoned diced potatoes and sautéed green and red peppers and onions,"Potatoes, Canola Oil, Green Bell Pepper, Onion, Red Bell Pepper, Kosher Salt, Black Pepper",,,0.8,4.1,4.4,2.4,1.3,5.0
Hash Browns,Potato,Pan-fried seasoned shredded potatoes,"Hash Brown Potato (Potatoes.  Contains 2% or less of Dextrose, Sodium Acid Pyrophosphate Added To Maintain Color.), Canola Oil, Kosher Salt, Black Pepper",,,0.5,2.7,3.4,2.3,0.1,2.8
Pancake,Pancakes/Waffles/French Toast,"Pancake using oat milk, rice flour and egg replacer","Oat Milk (Oat base (water, oats), low erucic acid rapeseed oil. Contains 2% or less of: dipotassium phosphate, calcium carbonate, tricalcium phosphate, sea salt, dicalcium phosphate, riboflavin, vitamin A acetate, vitamin D2, vitamin B12), Rice Flour (Sweet White Rice Flour, Whole Grain Brown Rice Flour, Potato Starch, Whole Grain Sweet White Sorghum Flour, Tapioca Flour, Xanthan Gum.), Egg Substitute (Potato Starch, Tapioca Flour, Baking Soda, Psyllium Husk Powder), Baking Powder, Granulated Sugar, Baking Soda, Pure Vanilla Extract, Kosher Salt",,,5.0,4.7,4.7,1.4,1.5,3.0
Buttermilk Pancakes,Pancakes/Waffles/French Toast,"Fluffy, golden brown buttermilk pancakes","Water, Pancake Mix  (ENRICHED BLEACHED FLOUR (BLEACHED WHEAT FLOUR, NIACINAMIDE, REDUCED IRON, THIAMIN MONONITRATE, RIBOFLAVIN, FOLIC ACID), SUGAR, LEAVENING (BAKING SODA, SODIUM ALUMINUM PHOSPHATE, MONOCALCIUM PHOSPHATE), DEXTROSE, BUTTERMILK POWDER, PALM OIL, SALT, WHEAT GLUTEN, CORN SYRUP SOLIDS, SODIUM CASEINATE, MONO AND DIGLYCERIDES, DIPOTASSIUM PHOSPHATE, LACTIC ACID, TOCOPHEROLS (TO PRESERVE FRESHNESS).)",,,5.0,3.3,2.7,0.4,0.9,5.0
Vanilla Iced Donut with Sprinkles,Yeast Bread,Freshly baked donut topped with vanilla icing and rainbow sprinkles,"Donut  (Enriched unbleached wheat flour (wheat flour, malted barley flour, niacin, iron as ferrous sulfate, thiamine mononitrate, enzyme, riboflavin, folic acid), water, palm oil, yeast, skim milk, dextrose, sugar, soybean oil. Contains less than 2%: whey (a milk derivative), salt, defatted soy flour, leavening (sodium acid pyrophosphate, baking soda), cellulose gum, sodium stearoyl lactylate, mono and diglycerides, to preserve freshness (calcium propionate), guar gum, xanthan gum, colored with (beta carotene), egg whites), Vanilla Icing (SUGAR, PALM OIL, WATER, CORN SYRUP, CORN STARCH. CONTAINS 2% OR LESS OF: SALT,MONOGLYCERIDES, YELLOWS 5 ; 6 AND OTHER COLOR ADDED, POLYSORBATE 60, POTASSIUM SORBATE (PRESERVATIVE), NATURALAND ARTIFICIAL FLAVOR, SODIUM STEAROYL LACTYLATE, SODIUM ACID PYROPHOSPHATE, CITRIC ACID, NONFAT MILK.), Rainbow Sprinkles (Sugar, Corn Starch, Palm & Palm Kernel Oil,  Soy Lecithin, Dextrin, Confectioners Glaze, Carnauba Wax, FD&C Colors,  Yellow #5 Lake, Yellow #6 Lake, Red #40 Lake, Blue #1 Lake, FD&C Red #3.)",,,2.4,4.7,3.8,1.0,0.9,1.9
Southern Biscuit,Biscuit,"Freshly baked warm, flaky biscuit","Biscuit (ENRICHED FLOUR BLEACHED (WHEAT FLOUR, NIACIN, FERROUS SULFATE, THIAMIN MONONITRATE, RIBOFLAVIN, FOLIC ACID), WATER, SOYBEAN OIL, HYDROGENATED SOYBEAN OIL, BUTTERMILK, SUGAR, SODIUM ALUMINUM PHOSPHATE, SALT, BAKING SODA, DATEM, CALCIUM ACID PYROPHOSPHATE, POTASSIUM BICARBONATE, WHEAT PROTEIN ISOLATE, PECTIN, CREAM, NATURAL FLAVOR.)",,,2.2,3.4,2.7,1.3,0.6,4.0
Old Fashioned Oatmeal,Cereal,Homestyle oatmeal cereal,"Water, Oatmeal",,,0.4,1.7,2.7,1.4,0.6,2.1
Overnight Oats,Cereal,"A creamy combination of oatmeal, milk, yogurt and honey. ","Plain Non-Fat Greek Yogurt (CULTURED GRADE A NON FAT MILK, LIVE & ACTIVE  CULTURES S. THERMOPHILUS AND L. BULGARICUS.), Reduced Fat Milk, Honey, Oatmeal, Cinnamon, Pure Vanilla Extract, Kosher Salt",,,2.4,3.6,3.6,0.9,3.3,4.2
UVA Tropical Smoothie,COLD - BEVERAGES,Mango and Pineapple smoothie,"Pineapple, Pineapple Juice, Ice Cubes, Mangos, Water",,,1.2,2.8,3.3,0.6,0.3,1.1
Fontana Double Chocolate Chip Espresso Muffin,QUICK BREADS,,"Low-Fat Buttermilk, Wheat Flour, Granulated Sugar, Chocolate Chips, Liquid Egg Whites, Baking Cocoa, Vegetable Oil Blend, Unsalted Butter, Baking Powder, Coffee, Pure Vanilla Extract, Kosher Salt",,,5.0,3.4,4.8,0.6,1.0,5.0
Cinnamon Sugar Mascarpone Crepe,Pancakes/Waffles/French Toast,Golden brown crepe filled with cinnamon sugar and mascarpone cheese,"Marscapone Cheese (Pasteurized cream and milk, citric acid/ latte pastorizzato, panna, adico citrico.), Wheat Flour (BLEACHED WHEAT FLOUR, MALTED BARLEY FLOUR, NIACIN, IRON, THIAMIN MONONITRATE, RIBOFLAVIN, FOLIC ACID.), Whole Milk, Water, Granulated Sugar, Liquid Whole Eggs (WHOLE EGGS, 19.0% WATER. CONTAINS 2% OR LESS OF THE FOLLOWING: SALT, XANTHAN GUM, CITRIC ACID, ANNATTO (COLOR), BUTTER FLAVOR (SUNFLOWER OIL, NATURAL FLAVORS, MEDIUM CHAIN TRIGLYCERIDES).), Vegetable Oil Blend (Vegetable Oil (May contain one or more of the following: Soybean, Canola, Corn, Sunflower Oil); Olive Oil; Colorant: Beta-Carotene E160a(i)), Cinnamon, Granulated Sugar, Kosher Salt",,,2.6,4.3,3.8,1.4,1.4,4.0
Smoked Chicken Apple Sausage,Meat/Cheese/Egg/Protein/Nut (MTO),Smoked chicken apple sausage,"Chicken Apple Sausage Link ((chicken thigh meat with skin, chicken breast meat with rib meat, water, contains 2% or less of salt, spices, dextrose, sugar, yeast extract, natural flavors, lactic acid. in collagen casing))",,,3.6,5.0,5.0,0.5,0.4,3.1
Egg Whites,Meat/Cheese/Egg/Protein/Nut (MTO),Liquid egg whites,,,,0.5,2.7,3.9,0.9,1.0,1.6
Shredded Cheddar Cheese,Meat/Cheese/Egg/Protein/Nut (MTO),Shredded Cheddar cheese,,,,1.3,2.3,4.0,1.2,0.4,5.0
Eggs,Meat/Cheese/Egg/Protein/Nut (MTO),Ready-to-use blended eggs,,,,0.5,1.3,3.0,1.5,0.1,2.8
Cottage Cheese,Meat/Cheese/Egg/Protein/Nut (MTO),Creamy cottage cheese,,,,0.4,2.4,2.6,0.2,0.6,3.9
Nonfat Strawberry Yogurt,Meat/Cheese/Egg/Protein/Nut (MTO),Creamy nonfat strawberry yogurt,,,,0.6,2.8,2.4,0.5,4.5,3.1
Nonfat Vanilla Yogurt,Meat/Cheese/Egg/Protein/Nut (MTO),Nonfat creamy vanilla yogurt,,,,1.3,1.6,2.2,1.0,3.3,4.3
Chia Quinoa Crunch,Meat/Cheese/Egg/Protein/Nut (MTO),Sweet and toasty quinoa and chia seed crunch,,,,2.6,1.5,2.2,0.0,0.4,1.7
Nonfat Greek Yogurt,Meat/Cheese/Egg/Protein/Nut (MTO),Nonfat Greek yogurt,,,,1.3,1.8,3.7,1.0,3.5,2.0
Toasted Sunflower Seeds,Meat/Cheese/Egg/Protein/Nut (MTO),Toasted sunflower seeds,,,,0.3,2.5,2.3,0.8,0.4,3.2
Chopped Fresh Spinach,Meat/Cheese/Egg/Protein/Nut (MTO),Chopped fresh spinach,,,,0.1,2.0,2.6,1.4,0.8,1.4
Honey Granola,Breads/Grains/Pasta/Cereal (MTO),"Crunchy cinnamon-spiced, honey-coated oats",,,,3.1,1.6,2.9,1.0,0.8,2.7
Toasted Coconut,Dessert/Dessert Topping (MTO),Toasted coconut flakes,,,,0.7,2.0,2.9,1.3,1.0,1.2
Fresh Fruit Salad,Fruit/Vegetable/Herb/Salad (MTO),"Fresh melon, pineapple and grapes","Honeydew, Cantaloupe, Red Grapes, Pineapple",,,3.6,2.0,2.7,1.2,1.4,1.0
Sliced Mushrooms,Fruit/Vegetable/Herb/Salad (MTO),Sliced fresh mushrooms,,,,1.3,2.9,3.3,1.0,1.2,2.4
Diced Onions,Fruit/Vegetable/Herb/Salad (MTO),Diced yellow onions,,,,0.6,1.9,4.3,1.0,1.5,2.6
Sliced Mixed Bell Peppers,Fruit/Vegetable/Herb/Salad (MTO),Sliced green and red bell peppers,,,,0.3,2.4,2.7,3.8,1.4,1.7
Diced Tomatoes,Fruit/Vegetable/Herb/Salad (MTO),Diced fresh tomatoes,,,,0.5,2.4,2.2,0.5,1.0,3.1
Toasted Pumpkin Seeds,Fruit/Vegetable/Herb/Salad (MTO),Crunchy pumpkin seeds,,,,0.4,2.2,2.4,0.8,1.0,1.5
Dried Cranberries,Fruit/Vegetable/Herb/Salad (MTO),Sweet-tart dried cranberries,,,,3.0,2.7,2.7,1.0,0.2,2.3
Fresh Fruit Salad,Fruit/Vegetable/Herb/Salad (MTO),"Fresh honey dew, cantaloupe, pineapple and grapes",,,,3.6,2.0,2.7,1.2,1.4,1.0
"GRAVY, SAUSAGE, MIX wr",Gravy,Southern Sausage Gravy ,"Water, Sausage Patty (Pork, Contains 2% or Less of: Water, Salt, Corn Syrup Solids, Flavorings, Sugar, Dextrose, BHT, Propyl Gallate, Citric Acid.), Gravy Mix (MALTODEXTRIN, WHEY, BLEACHED ENRICHED FLOUR (WHEAT FLOUR, NIACIN, REDUCED IRON, THIAMINE MONONITRATE, RIBOFLAVIN, FOLIC ACID), MODIFIEDCORNSTARCH, CANOLA OIL, SOYBEAN OIL, SKIM MILK, TAPIOCA STARCH, SALT, 2% OR LESS OF HYDROLYZED SOY, CORN AND WHEAT PROTEINS, SODIUM CASEINATE, XANTHAN GUM, SPICES, SUGAR, YEAST EXTRACT, CITRIC ACID, DISODIUM INOSINATE, NATURAL FLAVORS, DEXTROSE, DISODIUM GUANYLATE), Tabasco Hot Sauce (DISTILLED VINEGAR, RED PEPPER, SALT.), Black Pepper",,,1.9,4.9,4.2,3.6,2.5,2.8
