name,category,description,ingredients,diet_tags,allergens,sweet,salty,savory,spicy,sour,rich
Hard-Cooked Egg,Omelet/Quiche/Frittata/Strata,"Perfectly hard-cooked egg, featuring a firm yet tender white and a rich, creamy yolk","Water, Egg",,,1.3,2.5,4.8,1.4,0.3,5.0
Scrambled Just® Egg,Omelet/Quiche/Frittata/Strata,Scrambled Just® egg seasoned with salt & pepper,"Plant Based Egg (Water, Mung Bean Protein, Expeller-Pressed Canola Oil, Contains less than 2% of Dehydrated Onion, Gellan Gum, Carrot Extractives (color), Turmeric Extractives (color), Potassium Citrate, Salt, Sugar, Tapioca Syrup Solids, Tetrasodium Pyrophosphate, Transglutaminase, Nisin (preservative).), Canola Oil, Kosher Salt, Black Pepper",,,1.9,2.6,3.9,2.8,1.5,1.8
Scrambled Eggs,Omelet/Quiche/Frittata/Strata,Eggs gently scrambled to fluffy perfection,"Egg Blend (WHOLE EGGS, 19.0% WATER. CONTAINS 2% OR LESS OF THE FOLLOWING: SALT, XANTHAN GUM, CITRIC ACID, ANNATTO (COLOR), BUTTER FLAVOR (SUNFLOWER OIL, NATURAL FLAVORS, MEDIUM CHAIN TRIGLYCERIDES).)",,,1.3,4.1,4.4,1.0,0.9,3.0
Ranchero Breakfast Taco,Taco,"Flour tortilla filled with scrambled eggs, green chilies, green onion, crispy tortilla straws, cheddar cheese and ranchero sauce","Egg Blend (WHOLE EGGS, 19.0% WATER. CONTAINS 2% OR LESS OF THE FOLLOWING: SALT, XANTHAN GUM, CITRIC ACID, ANNATTO (COLOR), BUTTER FLAVOR (SUNFLOWER OIL, NATURAL FLAVORS, MEDIUM CHAIN TRIGLYCERIDES).), Tortilla (Enriched Bleached Flour (Flour, Niacin, Reduced Iron, Thiamine Mononitrate, Riboflavin, Folic Acid), Water, Vegetable Shortening (Interesterified and Hydrogenated Soybean Oils), contains 2% or less of: Salt, Baking Soda, Sodium Acid Pyrophosphate, Distilled Monoglycerides, Enzymes, Cellulose Gum, Fumaric Acid, and Calcium Propionate and Sorbic Acid (to maintain freshness).), Medium salsa (Tomatoes (Tomatoes, Tomato Juice, Citric Acid [To Acidify], Calcium Chloride [Firming]), Tomato Puree (Tomato Paste, Water), Onions, Water, Green Chile Peppers, Jalapeño Peppers, Contains 2% or less of Iodized Salt (Contains Potassium Iodate), Distilled Vinegar, Garlic Powder, Xanthan Gum, Spice, Paprika, Calcium Chloride (Firming), Citric Acid (To Acidify)), Tortilla (Whole Grain Corn, Water, contain 2% or less of: Guar Gum, Cellulose Gum, Enzymes, and Propionic Acid, Benzoic Acid and Phosphoric Acid (to maintain freshness).), Cheddar Cheese (Cheddar Cheese (Pasteurized Milk, Cheese Culture, Salt, Enzymes, Annatto [Vegetable Color]). Anti-Caking Blend (Potato Starch, Powdered Cellulose).), Green Chili Peppers, Water, Vegetable Oil Blend (Vegetable Oil (May contain one or more of the following: Soybean, Canola, Corn, Sunflower Oil); Olive Oil; Colorant: Beta-Carotene E160a(i)), Green Onion, Chipotle Peppers in Sauce (WATER, TOMATO PASTE, DRIED CHIPOTLE PEPPERS, DISTILLED VINEGAR, CORN OIL, CONTAINS 2% OR LESS OF IODIZED SALT (CONTAINS POTASSIUM IODATE), CORN STARCH, ONION POWDER, GARLIC POWDER, SPICES.), Kosher Salt, Black Pepper",,,1.0,3.3,3.6,2.3,4.2,4.0
Turkey Sausage Link,Breakfast Meat,Golden brown savory turkey sausage link,"Turkey Sausage (Turkey, Mechanically Separated Turkey, Water, Seasoning (Salt, Spices, Corn Syrup Solids, Spice Extractives, BHA, BHT, Citric Acid), Natural Flavoring. In a Calcium Alginate Casing.)",,,3.1,5.0,3.4,0.7,0.5,1.2
Bacon,Breakfast Meat,"Crisp, lightly smoked bacon strips","Bacon (Pork Cured With: Water, Salt, Sugar, Sodium Phosphates, Sodium Erythorbate, Sodium Nitrite.)",,,2.3,5.0,5.0,1.5,1.2,3.0
Turkey Bacon,Breakfast Meat,Crispy turkey bacon strip,"Turkey Bacon (Turkey, Water, Sugar, 2% or less of Salt, Canola Oil, Sun flower Oil, Natural Flavor, Sodium Phosphate, Potassium Diacetate, Potassium Acetate, Smoke Flavor, Sodium Erythorbate, Sodium Nitrite.)",,,3.4,5.0,2.1,1.3,0.7,2.9
O'Brien Potatoes,Potato,Pan-fried seasoned diced potatoes and sautéed green and red peppers and onions,"Potatoes, Canola Oil, Green Bell Pepper, Onion, Red Bell Pepper, Kosher Salt, Black Pepper",,,0.8,4.1,4.4,2.4,1.3,5.0
Hash Brown Potato Patty,Potato,Crispy fried shredded potato patty,"Hash Brown Potato (Potatoes, Vegetable Oil (Contains One Or More Of The Following Oils: Canola, Soybean, Cottonseed, Sunflower, Corn).  Contains 2% or less of Dehydrated Onion, Dextrose, Natural Flavor, Salt, Sodium Acid Pyrophosphate Added To Maintain Natural Color.)",,,0.8,2.4,3.8,0.4,1.3,4.4
Pancake,Pancakes/Waffles/French Toast,"Pancake using oat milk, rice flour and egg replacer","Oat Milk (Oat base (water, oats), low erucic acid rapeseed oil. Contains 2% or less of: dipotassium phosphate, calcium carbonate, tricalcium phosphate, sea salt, dicalcium phosphate, riboflavin, vitamin A acetate, vitamin D2, vitamin B12), Rice Flour (Sweet White Rice Flour, Whole Grain Brown Rice Flour, Potato Starch, Whole Grain Sweet White Sorghum Flour, Tapioca Flour, Xanthan Gum.), Egg Substitute (Potato Starch, Tapioca Flour, Baking Soda, Psyllium Husk Powder), Baking Powder, Granulated Sugar, Baking Soda, Pure Vanilla Extract, Kosher Salt",,,5.0,4.7,4.7,1.4,1.5,3.0
Buttermilk Pancakes,Pancakes/Waffles/French Toast,"Fluffy, golden brown buttermilk pancakes","Water, Pancake Mix  (ENRICHED BLEACHED FLOUR (BLEACHED WHEAT FLOUR, NIACINAMIDE, REDUCED IRON, THIAMIN MONONITRATE, RIBOFLAVIN, FOLIC ACID), SUGAR, LEAVENING (BAKING SODA, SODIUM ALUMINUM PHOSPHATE, MONOCALCIUM PHOSPHATE), DEXTROSE, BUTTERMILK POWDER, PALM OIL, SALT, WHEAT GLUTEN, CORN SYRUP SOLIDS, SODIUM CASEINATE, MONO AND DIGLYCERIDES, DIPOTASSIUM PHOSPHATE, LACTIC ACID, TOCOPHEROLS (TO PRESERVE FRESHNESS).)",,,5.0,3.3,2.7,0.4,0.9,5.0
Cherry-Topped Cinnamon Roll,Yeast Bread,Fresh baked cinnamon roll with cherry topping and icing drizzle,"Cinnamon Roll, Cherry Pie Filling, Vanilla Icing",,,0.1,2.5,3.2,0.2,0.9,1.3
Southern Biscuit,Biscuit,"Freshly baked warm, flaky biscuit","Biscuit (ENRICHED FLOUR BLEACHED (WHEAT FLOUR, NIACIN, FERROUS SULFATE, THIAMIN MONONITRATE, RIBOFLAVIN, FOLIC ACID), WATER, SOYBEAN OIL, HYDROGENATED SOYBEAN OIL, BUTTERMILK, SUGAR, SODIUM ALUMINUM PHOSPHATE, SALT, BAKING SODA, DATEM, CALCIUM ACID PYROPHOSPHATE, POTASSIUM BICARBONATE, WHEAT PROTEIN ISOLATE, PECTIN, CREAM, NATURAL FLAVOR.)",,,2.2,3.4,2.7,1.3,0.6,4.0
Old Fashioned Oatmeal,Cereal,Homestyle oatmeal cereal,"Water, Oatmeal",,,0.4,1.7,2.7,1.4,0.6,2.1
Overnight Oats,Cereal,"A creamy combination of oatmeal, milk, yogurt and honey. ","Plain Non-Fat Greek Yogurt (CULTURED GRADE A NON FAT MILK, LIVE & ACTIVE  CULTURES S. THERMOPHILUS AND L. BULGARICUS.), Reduced Fat Milk, Honey, Oatmeal, Cinnamon, Pure Vanilla Extract, Kosher Salt",,,2.4,3.6,3.6,0.9,3.3,4.2
Strawberry Pineapple Cucumber Smoothie,Beverage,Strawberry Pineapple Cucumber Smoothie,"Strawberries, Pineapple, Ice Cubes, Pineapple Juice, Cucumber, Water",,,1.4,2.4,4.0,0.8,1.1,2.9
Fontana Morning Glory Muffin,QUICK BREADS,,"Wheat Flour (BLEACHED WHEAT FLOUR, MALTED BARLEY FLOUR, NIACIN, IRON, THIAMIN MONONITRATE, RIBOFLAVIN, FOLIC ACID.), Granulated Sugar, Applesauce, Liquid Egg Whites (WHOLE EGGS, 19.0% WATER. CONTAINS 2% OR LESS OF THE FOLLOWING: SALT, XANTHAN GUM, CITRIC ACID, ANNATTO (COLOR), BUTTER FLAVOR (SUNFLOWER OIL, NATURAL FLAVORS, MEDIUM CHAIN TRIGLYCERIDES).), Vegetable Oil Blend (Vegetable Oil (May contain one or more of the following: Soybean, Canola, Corn, Sunflower Oil); Olive Oil; Colorant: Beta-Carotene E160a(i)), Carrots, Seedless Raisins, Baking Soda, Pure Vanilla Extract, Cinnamon, Kosher Salt",,,3.3,3.8,4.1,1.5,0.9,3.9
Spinach Mushroom Crepe,EGG/OMELET/QUICHE,"Golden brown crepe filled with sauteed spinach, mushrooms, and cheddar","Wheat Flour (BLEACHED WHEAT FLOUR, MALTED BARLEY FLOUR, NIACIN, IRON, THIAMIN MONONITRATE, RIBOFLAVIN, FOLIC ACID.), Whole Milk, Water, Spinach, Liquid Whole Eggs (WHOLE EGGS, 19.0% WATER. CONTAINS 2% OR LESS OF THE FOLLOWING: SALT, XANTHAN GUM, CITRIC ACID, ANNATTO (COLOR), BUTTER FLAVOR (SUNFLOWER OIL, NATURAL FLAVORS, MEDIUM CHAIN TRIGLYCERIDES).), Cheddar Cheese (Cheddar Cheese (Pasteurized Milk, Cheese Culture, Salt, Enzymes, Annatto [Vegetable Color]). Anti-Caking Blend (Potato Starch, Powdered Cellulose).), Mushrooms, Vegetable Oil Blend (Vegetable Oil (May contain one or more of the following: Soybean, Canola, Corn, Sunflower Oil); Olive Oil; Colorant: Beta-Carotene E160a(i)), Granulated Sugar, Kosher Salt",,,2.7,2.8,4.0,1.5,1.4,5.0
Egg Whites,Meat/Cheese/Egg/Protein/Nut (MTO),Liquid egg whites,,,,0.5,2.7,3.9,0.9,1.0,1.6
Shredded Cheddar Cheese,Meat/Cheese/Egg/Protein/Nut (MTO),Shredded Cheddar cheese,,,,1.3,2.3,4.0,1.2,0.4,5.0
Eggs,Meat/Cheese/Egg/Protein/Nut (MTO),Ready-to-use blended eggs,,,,0.5,1.3,3.0,1.5,0.1,2.8
Cottage Cheese,Meat/Cheese/Egg/Protein/Nut (MTO),Creamy cottage cheese,,,,0.4,2.4,2.6,0.2,0.6,3.9
Nonfat Strawberry Yogurt,Meat/Cheese/Egg/Protein/Nut (MTO),Creamy nonfat strawberry yogurt,,,,0.6,2.8,2.4,0.5,4.5,3.1
Nonfat Vanilla Yogurt,Meat/Cheese/Egg/Protein/Nut (MTO),Nonfat creamy vanilla yogurt,,,,1.3,1.6,2.2,1.0,3.3,4.3
Chia Quinoa Crunch,Meat/Cheese/Egg/Protein/Nut (MTO),Sweet and toasty quinoa and chia seed crunch,,,,2.6,1.5,2.2,0.0,0.4,1.7
Nonfat Greek Yogurt,Meat/Cheese/Egg/Protein/Nut (MTO),Nonfat Greek yogurt,,,,1.3,1.8,3.7,1.0,3.5,2.0
Toasted Sunflower Seeds,Meat/Cheese/Egg/Protein/Nut (MTO),Toasted sunflower seeds,,,,0.3,2.5,2.3,0.8,0.4,3.2
Chopped Fresh Spinach,Meat/Cheese/Egg/Protein/Nut (MTO),Chopped fresh spinach,,,,0.1,2.0,2.6,1.4,0.8,1.4
Honey Granola,Breads/Grains/Pasta/Cereal (MTO),"Crunchy cinnamon-spiced, honey-coated oats",,,,3.1,1.6,2.9,1.0,0.8,2.7
Toasted Coconut,Dessert/Dessert Topping (MTO),Toasted coconut flakes,,,,0.7,2.0,2.9,1.3,1.0,1.2
Fresh Fruit Salad,Fruit/Vegetable/Herb/Salad (MTO),"Fresh melon, pineapple and grapes","Honeydew, Cantaloupe, Red Grapes, Pineapple",,,3.6,2.0,2.7,1.2,1.4,1.0
Sliced Mushrooms,Fruit/Vegetable/Herb/Salad (MTO),Sliced fresh mushrooms,,,,1.3,2.9,3.3,1.0,1.2,2.4
Diced Onions,Fruit/Vegetable/Herb/Salad (MTO),Diced yellow onions,,,,0.6,1.9,4.3,1.0,1.5,2.6
Sliced Mixed Bell Peppers,Fruit/Vegetable/Herb/Salad (MTO),Sliced green and red bell peppers,,,,0.3,2.4,2.7,3.8,1.4,1.7
Diced Tomatoes,Fruit/Vegetable/Herb/Salad (MTO),Diced fresh tomatoes,,,,0.5,2.4,2.2,0.5,1.0,3.1
Toasted Pumpkin Seeds,Fruit/Vegetable/Herb/Salad (MTO),Crunchy pumpkin seeds,,,,0.4,2.2,2.4,0.8,1.0,1.5
Dried Cranberries,Fruit/Vegetable/Herb/Salad (MTO),Sweet-tart dried cranberries,,,,3.0,2.7,2.7,1.0,0.2,2.3
Fresh Fruit Salad,Fruit/Vegetable/Herb/Salad (MTO),"Fresh honey dew, cantaloupe, pineapple and grapes",,,,3.6,2.0,2.7,1.2,1.4,1.0
"GRAVY, SAUSAGE, MIX wr",Gravy,Southern Sausage Gravy ,"Water, Sausage Patty (Pork, Contains 2% or Less of: Water, Salt, Corn Syrup Solids, Flavorings, Sugar, Dextrose, BHT, Propyl Gallate, Citric Acid.), Gravy Mix (MALTODEXTRIN, WHEY, BLEACHED ENRICHED FLOUR (WHEAT FLOUR, NIACIN, REDUCED IRON, THIAMINE MONONITRATE, RIBOFLAVIN, FOLIC ACID), MODIFIEDCORNSTARCH, CANOLA OIL, SOYBEAN OIL, SKIM MILK, TAPIOCA STARCH, SALT, 2% OR LESS OF HYDROLYZED SOY, CORN AND WHEAT PROTEINS, SODIUM CASEINATE, XANTHAN GUM, SPICES, SUGAR, YEAST EXTRACT, CITRIC ACID, DISODIUM INOSINATE, NATURAL FLAVORS, DEXTROSE, DISODIUM GUANYLATE), Tabasco Hot Sauce (DISTILLED VINEGAR, RED PEPPER, SALT.), Black Pepper",,,1.9,4.9,4.2,3.6,2.5,2.8
