name,category,description,ingredients,diet_tags,allergens,sweet,sour,bitter,spicy,dry
Roast Pork Adobo,Roast/Braise,"Center-cut pork loin marinated in cider vinegar, garlic, oregano and ground black pepper","Pork Loin, Cider Vinegar, Vegetable Oil Blend (Vegetable Oil (May contain one or more of the following: Soybean, Canola, Corn, Sunflower Oil); Olive Oil; Colorant: Beta-Carotene E160a(i)), Garlic, Dried Oregano, Black Pepper, Paprika, Kosher Salt",,,,,,,
TRATTORIA CHICKEN PARMESAN,Deep Fried,"Chicken patty topped with a rich pomodoro sauce, melted mozzarella & Parmesan cheeses","Chicken Breast Patty (Boneless chicken breast with rib meat, water, seasoning [salt, flavors, maltodextrin, sugar, vegetable stock (carrot, onion, celery), garlic powder], salt, sodium phosphates. BREADED WITH: Wheat flour, water, salt, wheat gluten, leavening (sodium bicarbonate, sodium aluminum phosphate, monocalcium phosphate, sodium acid pyrophosphate), spices, garlic powder, onion powder, disodium inosinate and disodium guanylate, natural flavor. Breading set in vegetable oil.), Tomatoes, Mozzarella Cheese (Low-Moisture Part-Skim Mozzarella Cheese (Pasteurized Part-Skim Milk, Cheese Culture, Salt, Enzymes). Anti-Caking Blend (Potato Starch, Powdered Cellulose).), Water, Parmesan Cheese (Parmesan Cheese (Pasteurized Part-Skim Milk, Cheese Culture, Salt, Enzymes). Anti-Caking Blend (Potato Starch, Powdered Cellulose).), Basil, Garlic, Vegetable Oil Blend (Vegetable Oil (May contain one or more of the following: Soybean, Canola, Corn, Sunflower Oil); Olive Oil; Colorant: Beta-Carotene E160a(i)), Kosher Salt, Crushed Red Pepper",,,,,,,
Grilled Italian Vinaigrette Chicken Thigh,Grilled,Grilled chicken thigh marinated in fresh Italian Vinaigrette,"Chicken Thigh, Vegetable Oil Blend (Vegetable Oil (May contain one or more of the following: Soybean, Canola, Corn, Sunflower Oil); Olive Oil; Colorant: Beta-Carotene E160a(i)), Red Wine Vinegar, Basil, Honey, Garlic, Parsley, Kosher Salt, Crushed Red Pepper",,,,,,,
Roasted Eggplant Mezze,Bowl,Fragrant oven-baked eggplant and spicy carrot-mint slaw top hummus swirled with toasted cumin and drizzled with nutty roasted red pepper Romesco,"Garbanzo Beans, Eggplant, Flat Bread, Carrots, Lemon Juice, Tahini, Vegetable Oil Blend, Green Onion, Vegetable Oil Blend, Roasted Red Peppers, Vegetable Oil Blend, Orange Juice, Vegetable Oil Blend, Honey, Lemon Juice, Tomato Paste, Balsamic Vinegar, Almonds, Garlic, Parsley, Panko Bread Crumbs, Turmeric, Kosher Salt, Cinnamon, Cumin, Garlic, Sriracha Chili Sauce, Ginger Root, Mint, Garlic, Kosher Salt, Kosher Salt, Paprika, Paprika, Black Pepper, Kosher Salt, Cumin, Sriracha Chili Sauce, Crushed Red Pepper, Cinnamon",,,,,,,
Thai Red Curry Bowl,Bowl,Thai red curry with sweet potatoes and green beans served with jasmine rice topped with cilantro,"Sweet Potato, Coconut Milk (Coconut, Water, Guar gum.), Water, Water, Jasmine Rice, Green Beans, Red Curry Paste (GARLIC, RED CHILI PEPPER, SOYBEAN OIL, LEMONGRASS, GALANGAL ROOT (THAI GINGER), SALT, SHALLOT, CORIANDER ROOT, MAKRUT LIME PEEL & SPICES.), Onion, Red Bell Pepper, Vegetable Base (SAUTEED VEGETABLE PUREE MIX (CARROTS, ONIONS, CELERY), CORN STARCH, MALTODEXTRIN, VEGETABLE OIL (CORN AND/OR CANOLA OIL), HYDROLYZED CORN PROTEIN, YEAST EXTRACT, TOMATO POWDER, WATER, ONION POWDER, 2% OR LESS OF DISODIUM INOSINATE AND DISODIUM GUANYLATE, SALT, GARLIC POWDER, PAPRIKA (COLOR), NATURAL FLAVORS, LACTIC ACID, NATURAL FLAVOR, MODIFIED CORNSTARCH, CITRIC ACID.), Vegetable Oil Blend (Vegetable Oil (May contain one or more of the following: Soybean, Canola, Corn, Sunflower Oil); Olive Oil; Colorant: Beta-Carotene E160a(i)), Cilantro, Vegetable Oil Blend (Vegetable Oil (May contain one or more of the following: Soybean, Canola, Corn, Sunflower Oil); Olive Oil; Colorant: Beta-Carotene E160a(i)), Garlic, Kosher Salt, Cumin, Kosher Salt, Black Pepper, Coriander, Cardamom, Cinnamon, Cloves",,,,,,,
Vegan Bar Sesame Soy Tofu,Create Your Own,Extra firm tofu marinated in a sesame soy marinade,"Tofu, Cornstarch, Sesame Oil, Soy Sauce, Ginger Root, Brown Sugar, Garlic, Orange Juice, Crushed Red Pepper",,,,,,,
OH Classic Cheese Pizza,"Traditional 16""",House-made pizza dough topped with tomato and fresh basil sauce and a generous layer of melted mozzarella,"All Purpose Flour (Bleached  Wheat Flour, Malted Barley Flour, Niacin, Iron, Potassium Bromate, Thiamin  Mononitrate, Riboflavin, Folic Acid.), Water, Mozzarella Cheese (Low-Moisture Part-Skim Mozzarella Cheese (Pasteurized Part-Skim Milk, Cheese Culture, Salt, Enzymes). Anti-Caking Blend (Potato Starch, Powdered Cellulose).), Crushed Tomatoes (VINE RIPENED TOMATOES, TOMATO PUREE, SEA SALT,  CITRIC ACID.), Extra Virgin Olive Oil, Granulated Sugar, Salt, Basil, Yeast, Kosher Salt, Garlic",,,,,,,
OH Pepperoni Pizza,"Traditional 16""","House-made pizza dough topped with crispy pepperoni slices, tomato fresh basil sauce and mozzarella cheese","All Purpose Flour (Bleached  Wheat Flour, Malted Barley Flour, Niacin, Iron, Potassium Bromate, Thiamin  Mononitrate, Riboflavin, Folic Acid.), Water, Mozzarella Cheese (Low-Moisture Part-Skim Mozzarella Cheese (Pasteurized Part-Skim Milk, Cheese Culture, Salt, Enzymes). Anti-Caking Blend (Potato Starch, Powdered Cellulose).), Crushed Tomatoes (VINE RIPENED TOMATOES, TOMATO PUREE, SEA SALT,  CITRIC ACID.), Deli Pepperoni (CHICKEN, BEEF, TURKEY, SALT, CONTAINS 2% OR LESS OF WATER, DEXTROSE, SPICES, SMOKE FLAVORING, FLAVORING, GARLIC POWDER, OLEORESIN OF PAPRIKA, ROSEMARY EXTRACT, SODIUM ASCORBATE, SPICE EXTRACIVE, CITRIC ACID, LACTIC ACID STARTER CULTURE BHA, BHT, SODIUM NITRITE.  BHA, BHT WITH CITRIC ACID ADDED TO HELP PROTECT FLAVOR. SMOKE FLAVORING ADDED), Extra Virgin Olive Oil, Granulated Sugar, Salt, Basil, Yeast, Kosher Salt, Garlic",,,,,,,
Margherita Pizza,"Traditional 16""",Fresh sliced plum tomatoes and shredded basil with mozzarella and a sprinkle of Italian seasoning,"All Purpose Flour (Bleached  Wheat Flour, Malted Barley Flour, Niacin, Iron, Potassium Bromate, Thiamin  Mononitrate, Riboflavin, Folic Acid.), Mozzarella Cheese (Low-Moisture Part-Skim Mozzarella Cheese (Pasteurized Part-Skim Milk, Cheese Culture, Salt, Enzymes). Anti-Caking Blend (Potato Starch, Powdered Cellulose).), Water, Tomato , Vegetable Oil Blend (Vegetable Oil (May contain one or more of the following: Soybean, Canola, Corn, Sunflower Oil); Olive Oil; Colorant: Beta-Carotene E160a(i)), Basil, Kosher Salt, Granulated Sugar, Yeast, Italian Seasoning (MARJORAM, THYME, ROSEMARY, SAVORY, SAGE, OREGANO, AND BASIL.)",,,,,,,
Char-Grilled Turkey Burger,Burger,"White-meat turkey burger served hot-off-the-grill on a fresh, soft bun","Turkey Burger, Roll",,,,,,,
Grilled Black Bean Burger,Burger,"Gardenburger® black bean burger served hot-off-the-grill on a fresh, soft bun","Black Bean Veggie Burger, Roll",,,,,,,
Baja Turkey Wrap,Artisan,"Turkey, Guacamole, lettuce, tomato, onion and plant based chipotle mayo on a wrap","Water, Tortilla Variety Pack (Enriched Bleached Flour (Wheat Flour, Niacin, Reduced Iron, Thiamine Mononitrate, Riboflavin, Folic Acid), Water, Vegetable Shortening (Interesterified and Hydrogenated Soybean Oils), contains 2% or less of: Salt, Sodium Acid Pyrophosphate, Baking Soda, Distilled Monoglycerides, Enzymes, Vital Wheat Gluten, Cellulose Gum, Fumaric Acid, and Calcium Propionate and Sorbic Acid (to maintain freshness). TOMATO BASIL SEASONING (Tomato Powder, Spices, Salt, Sugar, Red Bell Pepper, Sun-Dried Tomato, Soybean Oil, Yeast, Onion Powder, Garlic Powder, Natural And Artificial Flavor, Extractives of Paprika); SPINACH HERB SEASONING (Spinach Powder, Onion Powder, Spice, Salt, Garlic Powder, Soybean Oil, Yellow 5 Lake, Blue 1 Lake, Natural And Artificial Flavor), Dextrose, Artificial Flavors, Propylen Glycol, Yellow 5, Blue 1; GARLIC HERB SEASONING (Sugar, Corn Maltodextrin, Salt, Modified Corn Starch, Spices, Dehydrated Garlic, Red Bell Pepper, Medium Chain Triglycerides, Dehydrated Tomato, Natural and Artificial Flavor, Onion powder).), Tomato, Vegan Mayonnaise (CANOLA OIL, WATER, SOYBEAN OIL, SUGAR, DISTILLED VINEGAR, SALT, CONTAINS 2% OR LESS OF EACH OF THE FOLLOWING: MODIFIED FOOD STARCH (CORN, POTATO), LEMON JUICE CONCENTRATE, NATURAL FLAVOR, CALCIUM DISODIUM EDTA (USED TO PROTECT QUALITY), PAPRIKA OLEORESIN.), Deli Turkey Breast, Onion, Kosher Salt, Guacamole (Hass Avocados, Distilled Vinegar, Contains 2% Or Less Of: Water, Jalapeño Peppers, Salt, Dehydrated Onion, Granulated Garlic, Erythorbic Acid (To Maintain Color), Sugar, Citric Acid (To Acidify).), Cider Vinegar, Lettuce, Brown Sugar, Chipotle Peppers in Sauce (WATER, TOMATO PASTE, DRIED CHIPOTLE PEPPERS, DISTILLED VINEGAR, CORN OIL, CONTAINS 2% OR LESS OF IODIZED SALT (CONTAINS POTASSIUM IODATE), CORN STARCH, ONION POWDER, GARLIC POWDER, SPICES.), Mint, Thyme, Lime Juice, Kosher Salt, Rosemary, Cilantro",,,,,,,
Boardwalk Tofu Wrap,Artisan,Italian seasoned tofu and spicy pepper relish on a spinach wrap,"Spinach Herb Tortilla, Tofu, Cherry Peppers, Banana Peppers, Roasted Red Peppers, Red Wine Vinegar, Pickle , Onion, Italian Seasoning, Garlic Powder, Kosher Salt",,,,,,,
Corner Chicken Salad Croissant,Artisan,Creamy chicken salad with lettuce & tomato on a buttery croissant,"Croissant, Chicken, Tomato, Mayonnaise, Cucumber, Celery, Lettuce, Dijon Mustard, Lemon Juice, Black Pepper",,,,,,,
Cavalier Club,Club,"Turkey, Ham, Bacon, lettuce, tomato & herb cream cheese layered on toasted artisan country white bread","Sour Dough Bread, Water, Bacon, Lettuce, Deli Ham, Tomato, Deli Turkey Breast, Onion, Kosher Salt, Cream Cheese, Brown Sugar, Mint, Lemon Juice, Thyme, Green Onion, Parsley, Rosemary, Garlic, Dried Tarragon, Basil, Kosher Salt, Crushed Red Pepper",,,,,,,
Meze Tomato Cucumber Salad,Side Salad,Plum tomatoes and cucumbers tossed in lemon herb dressing,"Cucumber, Tomato, Extra Virgin Olive Oil, Red Wine Vinegar, Water, Lemon Juice, Garlic, Basil, Parsley, Kosher Salt, Dried Oregano, Black Pepper",,,,,,,
Roasted Cauliflower,Vegetables - Non-Green,Fresh cauliflower seasoned and roasted,"Cauliflower, Vegetable Oil Blend (Vegetable Oil (May contain one or more of the following: Soybean, Canola, Corn, Sunflower Oil); Olive Oil; Colorant: Beta-Carotene E160a(i)), Kosher Salt, Black Pepper",,,,,,,
Roasted Mushrooms,Vegetables - Non-Green,"Sliced mushrooms roasted with oil, salt and pepper","Mushrooms, Canola Oil, Kosher Salt, Black Pepper",,,,,,,
Green Chili Calabacitas,Vegetables - Non-Green,Sauteed zucchini with corn and green chilies,"Squash Zucchini, Corn Kernels, Green Chili Peppers, Onion, Vegetable Oil Blend (Vegetable Oil (May contain one or more of the following: Soybean, Canola, Corn, Sunflower Oil); Olive Oil; Colorant: Beta-Carotene E160a(i)), Garlic, Kosher Salt, Black Pepper",,,,,,,
Spaghetti Squash,Vegetables - Non-Green,Piping hot spaghetti squash tossed with lemon zest,"Spaghetti Squash, Lemon Zest, Garlic  Herb Seasoning, Black Pepper",,,,,,,
Capri Blend Vegetables,Vegetables - Non-Green,"Steamed fresh carrots, whole green beans and zucchini and yellow squash","Green Beans, Carrots, Squash Zucchini, Squash",,,,,,,
Roasted Shawarma Chickpeas,Legumes,"Crispy, roasted shawarma-seasoned chickpeas","Garbanzo Beans, Vegetable Oil Blend (Vegetable Oil (May contain one or more of the following: Soybean, Canola, Corn, Sunflower Oil); Olive Oil; Colorant: Beta-Carotene E160a(i)), Kosher Salt, Cumin, Garlic Powder, Paprika, Kosher Salt, Black Pepper, Coriander, Allspice, Turmeric, Cinnamon",,,,,,,
Crispy Seasoned French Fries,Potato,Piping hot crispy shoestring French fries seasoned with a fresh seasoning blend,"French Fries (Potatoes, Vegetable Oil (Contains One Or More Of The Following Oils: Canola, Soybean, Cottonseed, Sunflower, Corn), Potato Starch - Modified. Contains 2% or less of Dextrin, Dextrose, Leavening (Sodium Acid Pyrophosphate, Sodium Bicarbonate), Pea Fiber, Pea Protein, Rice Flour, Salt, Sodium Acid Pyrophosphate Added To Maintain Color, Xanthan Gum.), Kosher Salt, Paprika, Garlic Powder",,,,,,,
Farro,Grains,Cooked whole grain farro,"Water, Farro",,,,,,,
Grilled Cumin Lime Chicken,POULTRY ENTREE,"Tender boneless chicken marinated in lime juice, cumin, and garlic","Chicken Breast (Boneless skinless chicken breast filets with rib meat CONTAINING: Up to 15% of a solution of water, sea salt.), Lime Juice, Cumin, Vegetable Oil Blend (Vegetable Oil (May contain one or more of the following: Soybean, Canola, Corn, Sunflower Oil); Olive Oil; Colorant: Beta-Carotene E160a(i)), Garlic, Cayenne Pepper",,,,,,,
Shredded Cheddar Cheese,Meat/Cheese/Egg/Protein/Nut (MTO),Shredded Cheddar cheese,,,,,,,,
Black Beans,Meat/Cheese/Egg/Protein/Nut (MTO),Black beans,,,,,,,,
Chopped Hard-Cooked Egg,Meat/Cheese/Egg/Protein/Nut (MTO),Chopped hard-cooked egg,,,,,,,,
O'Hill Smash Burger*,Meat/Cheese/Egg/Protein/Nut (MTO),Juicy burger pressed with American cheese on a Martin's potato roll,"Ground Beef, Hamburger Roll (Unbleached Enriched Wheat Flour (flour, Ferrous Sulfate, Niacin, Thiamin, Riboflavin, Folic Acid), Nonfat Milk, Reconstituted Potatoes (from Potato Flour), Yeast, Sugar, Cane Sugar Syrup, Wheat Gluten, Sunflower Oil, Contains 2 Percent Or Less Of Each Of The Following: Salt, Butter, Dough Conditioners (sodium Stearoyl Lactylate, Monoglycerides And Diglycerides), Monocalcium Phosphate, Cultured Wheat Flour, Calcium Propionate (a Preservative), Guar Gum, Ascorbic Acid, Datem, Calcium Sulfate, Enzymes, Turmeric Color, Annatto Color, Sesame Seeds.), American Cheese (American Cheese (Milk, Cheese Culture, Salt, Enzymes), Water, Cream, Potassium Citrate, Sodium Citrate, Sorbic Acid As A Preservative, Color Added, Sunflower Lecithin (Release Agent).), Kosher Salt, Black Pepper",,,,,,,
Chopped Fresh Spinach,Meat/Cheese/Egg/Protein/Nut (MTO),Chopped fresh spinach,,,,,,,,
Cilantro-Lime Brown Rice,Breads/Grains/Pasta/Cereal (MTO),Brown rice with lime juice and fresh cilantro,"Water, Whole Grain Brown Rice, Lime Juice, Vegetable Base (SAUTEED VEGETABLE PUREE MIX (CARROTS, ONIONS, CELERY), CORN STARCH, MALTODEXTRIN, VEGETABLE OIL (CORN AND/OR CANOLA OIL), HYDROLYZED CORN PROTEIN, YEAST EXTRACT, TOMATO POWDER, WATER, ONION POWDER, 2% OR LESS OF DISODIUM INOSINATE AND DISODIUM GUANYLATE, SALT, GARLIC POWDER, PAPRIKA (COLOR), NATURAL FLAVORS, LACTIC ACID, NATURAL FLAVOR, MODIFIED CORNSTARCH, CITRIC ACID.), Cilantro, Black Pepper",,,,,,,
Goldfish® Crackers,Breads/Grains/Pasta/Cereal (MTO),Cheese-flavored Goldfish® Crackers,,,,,,,,
Croutons,Breads/Grains/Pasta/Cereal (MTO),Homestyle seasoned croutons,,,,,,,,
Spaghetti,Breads/Grains/Pasta/Cereal (MTO),Fresh cooked al dente spaghetti,,,,,,,,
Baba Ghanoush,Spread,"A dip of mashed roasted eggplant, tahini, parsley, garlic and oil","Eggplant, Lemon Juice, Tahini (SESAME SEEDS.), Canola Oil, Parsley, Garlic, Kosher Salt, Black Pepper",,,,,,,
Smoky Chipotle Mayo,Spread,Vegan mayonnaise blended with chipotle peppers and cider vinegar,"Vegan Mayonnaise (CANOLA OIL, WATER, SOYBEAN OIL, SUGAR, DISTILLED VINEGAR, SALT, CONTAINS 2% OR LESS OF EACH OF THE FOLLOWING: MODIFIED FOOD STARCH (CORN, POTATO), LEMON JUICE CONCENTRATE, NATURAL FLAVOR, CALCIUM DISODIUM EDTA (USED TO PROTECT QUALITY), PAPRIKA OLEORESIN.), Cider Vinegar, Chipotle Peppers in Sauce (WATER, TOMATO PASTE, DRIED CHIPOTLE PEPPERS, DISTILLED VINEGAR, CORN OIL, CONTAINS 2% OR LESS OF IODIZED SALT (CONTAINS POTASSIUM IODATE), CORN STARCH, ONION POWDER, GARLIC POWDER, SPICES.), Kosher Salt",,,,,,,
Meze Tzatziki Sauce,Spread,"Creamy blend of yogurt and sour cream with cucumbers, onion, lemon juice, garlic and mint","Sour Cream (Cultured Non-Fat Milk, Cream, Contains Less than 2% of: Whey, Food Starch-Modified (Corn), Sodium Phosphate (Sodium Tripolyphosphate), Guar Gum, Carrageenan, Calcium Sulfate, Locust Bean Gum, Potassium Sorbate (preservative).), Plain Non-Fat Greek Yogurt (CULTURED GRADE A NON FAT MILK, LIVE & ACTIVE  CULTURES S. THERMOPHILUS AND L. BULGARICUS.), Cucumber, Lemon Juice, Garlic, Mint, Kosher Salt, Black Pepper",,,,,,,
Sliced Red Onions,Fruit/Vegetable/Herb/Salad (MTO),Thinly sliced red onions,,,,,,,,
Feta Cheese Crumbles,Fruit/Vegetable/Herb/Salad (MTO),Crumbled feta,,,,,,,,
Romaine Lettuce,Fruit/Vegetable/Herb/Salad (MTO),Chopped romaine lettuce,,,,,,,,
Grape Tomatoes,Fruit/Vegetable/Herb/Salad (MTO),Fresh grape tomatoes,,,,,,,,
Sliced Green Bell Peppers,Fruit/Vegetable/Herb/Salad (MTO),Sliced green bell peppers,,,,,,,,
Roasted Corn,Fruit/Vegetable/Herb/Salad (MTO),Roasted corn tossed with salt and pepper,,,,,,,,
Sliced Red Bell Peppers,Fruit/Vegetable/Herb/Salad (MTO),Sliced red bell peppers,,,,,,,,
Shredded Carrots,Fruit/Vegetable/Herb/Salad (MTO),Shredded fresh carrots,,,,,,,,
Spring Salad Mix,Fruit/Vegetable/Herb/Salad (MTO),Fresh spring lettuce mix,,,,,,,,
Green Leaf Lettuce,Fruit/Vegetable/Herb/Salad (MTO),Green whole leaf lettuce,,,,,,,,
Sliced Tomatoes,Fruit/Vegetable/Herb/Salad (MTO),Sliced fresh tomatoes,,,,,,,,
Caramelized Onions,Fruit/Vegetable/Herb/Salad (MTO),Sliced onions slowly sauteed until golden,,,,,,,,
Sliced Cucumber,Fruit/Vegetable/Herb/Salad (MTO),Sliced fresh cucumber,,,,,,,,
Chilled Roasted Mushrooms,Fruit/Vegetable/Herb/Salad (MTO),Chilled roasted fresh button mushrooms tossed with garlic and herbs,,,,,,,,
Parmesan Cracker,Salad Component,Shredded Parmesan baked till crisp and golden-brown,"Parmesan Cheese (Parmesan Cheese (Pasteurized Part-Skim Milk, Cheese Culture, Salt, Enzymes). Anti-Caking Blend (Potato Starch, Powdered Cellulose).)",,,,,,,
Dill Pickle Slices,Condiments/Spreads/Dressings/Sauces/Salsas (MTO),Dill pickle slices,"Pickle Slices (FRESH  CUCUMBERS, WATER, SALT, DISTILLED VINEGAR, CONTAINS LESS THAN 2% OF DRIED  GARLIC, CALCIUM CHLORIDE, SPICE, SODIUM BENZOATE (TO PRESERVE FLAVOR),  MUSTARD SEED, DRIED RED PEPPERS, NATURAL FLAVOR, POLYSORBATE 80, OLEORESIN  TURMERIC)",,,,,,,
Spicy Hummus Vinaigrette,Condiments/Spreads/Dressings/Sauces/Salsas (MTO),Hummus mixed with harissa sauce,"Hummus, Harissa Paste , Lemon Juice, Extra Virgin Olive Oil, Kosher Salt",,,,,,,
Ranch Dressing,Condiments/Spreads/Dressings/Sauces/Salsas (MTO),Homestyle creamy ranch salad dressing,,,,,,,,
Mayonnaise,Condiments/Spreads/Dressings/Sauces/Salsas (MTO),Mayonnaise,,,,,,,,
Burger Sauce,Condiments/Spreads/Dressings/Sauces/Salsas (MTO),"Creamy blend of mayonnaise, ketchup, sweet pickle relish, Worcestershire and hot pepper sauce",,,,,,,,
